tweet_id,tweet,user_id,user_name,user_screen_name,timestamp,retweets,favourites
298018265593159681,やっと新約禁書半分読めた！一日一章で寝落ちしちゃってね。今日はあと半分読み切ってしまいたい。,149214651,一榎,ortensia266,2013-02-03 19:41:06,0,0
298111940880891904,あれ？プリキュアに櫻井がいる？？,149214651,一榎,ortensia266,2013-02-04 01:53:20,0,0
298452983853764608,あかん、凄く眠い。,149214651,一榎,ortensia266,2013-02-05 00:28:31,0,0
298453674630471681,なんかイラっとしたり、困ったり。,149214651,一榎,ortensia266,2013-02-05 00:31:15,0,0
298793120697577473,フラゲしたらかっきーしか聴いてないや。,149214651,一榎,ortensia266,2013-02-05 23:00:05,0,0
299324401659305984,スケミスで今日オフとか…,149214651,一榎,ortensia266,2013-02-07 10:11:13,0,0
299324786394419200,こうなったら歩いて他のTSUTAYAまで行こう。,149214651,一榎,ortensia266,2013-02-07 10:12:44,0,0
299381414384787456,TSUTAYAめっちゃ遠かった…。片道歩いて1時間ぐらいだし。,149214651,一榎,ortensia266,2013-02-07 13:57:46,0,0
299506049986199553,結局、夕方ぐらいまで歩き回ったかな。,149214651,一榎,ortensia266,2013-02-07 22:13:01,0,0
299585913036619777,綺羅星連発してたな〜。,149214651,一榎,ortensia266,2013-02-08 03:30:22,0,0
299879618314395648,昨日と今日で曲増えすぎたかな(^_^),149214651,一榎,ortensia266,2013-02-08 22:57:27,0,0
299880255924088833,Xシリーズが一番好き。あとはTOS、TOSR、TOD2、TOGかな。#週末のテイルズクラスタ大フォロー祭,149214651,一榎,ortensia266,2013-02-08 22:59:59,0,0
299881397496197120,やっと黒バスのデュエット黒子と黄瀬借りたの。あとは日向〜女子二人とデュエット2枚長いわ…。最初で諦めたからね。,149214651,一榎,ortensia266,2013-02-08 23:04:31,0,0
299882709608710145,私きっとひよっちのシングルとか買うな…,149214651,一榎,ortensia266,2013-02-08 23:09:44,0,0
299884049672065025,@hasumi72 遅ればせながら読ませてもらいました！一読者としてジャンル的に好きだったので残念です…。本当にお疲れ様でした(>_<)噂屋を読みながら次回作待ってますっ！,149214651,一榎,ortensia266,2013-02-08 23:15:03,0,0
300238557979758593,かっきーのアルバム内金全額出して来た。エントリーせんとな。,149214651,一榎,ortensia266,2013-02-09 22:43:45,0,0
300547917654151168,やっぱり丸亀製麺の天ぷらうまいよ♪( ´▽｀),149214651,一榎,ortensia266,2013-02-10 19:13:02,0,0
300560298652352512,@yukoyako 天ぷらのために行っちゃいそうだね(>_<),149214651,一榎,ortensia266,2013-02-10 20:02:13,0,0
300567836651315200,@yukoyako どうなんだろ？出来たら持ち帰りたい！,149214651,一榎,ortensia266,2013-02-10 20:32:11,0,0
300572669357727744,@yukoyako 持ち帰れたら家でおかずに出来るね♪,149214651,一榎,ortensia266,2013-02-10 20:51:23,0,0
300572785619660801,KAmiYUなのね。,149214651,一榎,ortensia266,2013-02-10 20:51:51,0,0
300590973371695104,@yukoyako こどもにおつかいwww,149214651,一榎,ortensia266,2013-02-10 22:04:07,0,0
300593600637583360,絶テンイベントからやたらと近くのイベントに行きたくなる衝動が止まらない。,149214651,一榎,ortensia266,2013-02-10 22:14:33,0,0
300604552875474944,@yukoyako angelaのチェキ撮影会が地元でやるらしいのww行くしかないなって思っちゃう(^-^),149214651,一榎,ortensia266,2013-02-10 22:58:05,0,0
300605674675642368,もうすぐ終わっちゃうけど、細谷さん誕生日おめでとう(^-^),149214651,一榎,ortensia266,2013-02-10 23:02:32,0,0
300606256115232768,この二人が好きだなぁ。きっと良平くんの影響で浅沼さん好きになったんだな。,149214651,一榎,ortensia266,2013-02-10 23:04:51,0,0
300607784339259392,@k_aza おかえりなさいです♪,149214651,一榎,ortensia266,2013-02-10 23:10:55,0,0
300658042100408322,@Wakomil 遅くなりました！こちらこそフォローありがとうございます♪よろしくですっ(^-^),149214651,一榎,ortensia266,2013-02-11 02:30:37,0,0
300658973936320512,文教堂の特典の絵って何の雑誌に載ってたのかな？,149214651,一榎,ortensia266,2013-02-11 02:34:20,0,0
300844436647202816,@Wakomil こちらも呼びタメ歓迎です♪あきなって呼びます(^-^)よろしくです！,149214651,一榎,ortensia266,2013-02-11 14:51:17,0,0
300928058586705920,@Wakomil うん♪わこちゃんと呼んでいい？,149214651,一榎,ortensia266,2013-02-11 20:23:34,0,0
300945967681794048,@ray_kamimori いえいえ、こちらこそよろしくお願いします♪,149214651,一榎,ortensia266,2013-02-11 21:34:44,0,0
300963613567512577,お腹の調子がよろしくないな。やっぱり夜中寒いんだなぁ。,149214651,一榎,ortensia266,2013-02-11 22:44:51,0,0
301374497515261952,@mare2134 寝てるとこごめんっ！今日集合場所新京極の交番前にしましょ？時間は19:30で！,149214651,一榎,ortensia266,2013-02-13 01:57:34,0,0
301374663962025984,うん、シンとトーマがいないと物足りない。,149214651,一榎,ortensia266,2013-02-13 01:58:13,0,0
301374856312782849,そういえばangelaイベの参加券手に入れたっ♪,149214651,一榎,ortensia266,2013-02-13 01:58:59,0,0
301374957399732224,あとやっとKの原画集も。,149214651,一榎,ortensia266,2013-02-13 01:59:23,0,0
301619711735640064,もうそろそろ出ようかな。,149214651,一榎,ortensia266,2013-02-13 18:11:57,0,0
301718097256148993,@mare2134 おかえり(^-^)私もあと少しで家だわ。汗だくだわww,149214651,一榎,ortensia266,2013-02-14 00:42:54,0,0
301718348490756099,歩くつもりだったのに走ったから思ったより早く着きそう。,149214651,一榎,ortensia266,2013-02-14 00:43:54,0,0
301719970050609152,ちょっ、多々良の誕生日だからってTLが多々良で埋まるww,149214651,一榎,ortensia266,2013-02-14 00:50:21,0,0
301721295236759552,@mare2134 大丈夫よ♪今度はユニバ計画とかカラオケしよか(^-^)あっ、KiramuneのライビュがTジョイで明日プレオーダー受付なんやけど行く？？,149214651,一榎,ortensia266,2013-02-14 00:55:37,0,0
301721548052627456,言ったはずなのにキャラとして多々良好きだわ(>_<),149214651,一榎,ortensia266,2013-02-14 00:56:37,0,0
301731300841230337,@mare2134 4月14日だって。日曜日だよ♪多分夜公演(^-^),149214651,一榎,ortensia266,2013-02-14 01:35:22,0,0
301731419653304321,ほかいま〜！たまこま観なきゃ！,149214651,一榎,ortensia266,2013-02-14 01:35:51,0,0
301733437432283136,@mare2134 了解♪とりあえずみなみちゃんと計画しなきゃだね！,149214651,一榎,ortensia266,2013-02-14 01:43:52,0,0
301733540670873601,@handoukeisei ほかありです♪,149214651,一榎,ortensia266,2013-02-14 01:44:16,0,0
301734415862734848,杉田が逢坂くんの名前叫んでるww,149214651,一榎,ortensia266,2013-02-14 01:47:45,0,0
301734866406498305,@mare2134 ユニバで一応計画してみよ！多分ユニバなら合わせられるはず…！,149214651,一榎,ortensia266,2013-02-14 01:49:32,0,0
301735113178353664,カラオケ行きたいけど、ゲームもしたい。,149214651,一榎,ortensia266,2013-02-14 01:50:31,0,0
301735547079098368,ニャンコ先生の中華まんほしい！,149214651,一榎,ortensia266,2013-02-14 01:52:15,0,0
301738335452422144,@mare2134 今度はカラオケも行きたいな♪( ´▽｀)全然行ってないのよ(￣O￣;)3月ぐらいなら合わせられるかな？,149214651,一榎,ortensia266,2013-02-14 02:03:19,0,0
301738574640988160,早く俺修羅みたいんだけどまだ？最近逢坂くんも好きなんだよね。,149214651,一榎,ortensia266,2013-02-14 02:04:16,0,0
301738934986223616,ラノベは主人公基本好きになるな。,149214651,一榎,ortensia266,2013-02-14 02:05:42,0,0
301739430727806976,ホムペ作ってしまおうか、それとも現状維持か。,149214651,一榎,ortensia266,2013-02-14 02:07:40,0,0
301748376263864320,かっこいいな、鋭太。,149214651,一榎,ortensia266,2013-02-14 02:43:13,0,0
302064933376499712,やっとガルスタ買ったら千歳がぁぁぁぁぁ（≧∇≦）,149214651,一榎,ortensia266,2013-02-14 23:41:06,0,0
302092660880064513,@Riku_0902 フォローありがとうございます！呼びタメ歓迎ですので、気軽に話しかけて下さい(^-^),149214651,一榎,ortensia266,2013-02-15 01:31:17,0,0
302092937888661504,アルカナ2と十鬼のFDは買うな、絶対。,149214651,一榎,ortensia266,2013-02-15 01:32:23,0,0
302371558746357760,ジャーマンポテトの鯛焼き美味しかった♪,149214651,一榎,ortensia266,2013-02-15 19:59:32,0,0
302372046715895808,@sogorukyo 美味しそうですね(^-^),149214651,一榎,ortensia266,2013-02-15 20:01:28,0,0
302372919839977472,とうとうグレイセスを買ってしまったww,149214651,一榎,ortensia266,2013-02-15 20:04:56,0,0
302374536727392256,買い食いした分のカロリー消費で歩いてたら雨降ってきた（泣）,149214651,一榎,ortensia266,2013-02-15 20:11:22,0,0
302375577447460864,@mare2134 どんまいっ！,149214651,一榎,ortensia266,2013-02-15 20:15:30,0,0
302375956205678593,家までが遠い。交通機関ないのイタイ。,149214651,一榎,ortensia266,2013-02-15 20:17:00,0,0
302791472091131906,スタバの桜タンブラー手に入れた！もう三店舗回って一店舗しか置いてなくて…。でも店員さんすっごい優しかった♪,149214651,一榎,ortensia266,2013-02-16 23:48:07,0,0
303117110337470465,昨日やっと少年編終わった！,149214651,一榎,ortensia266,2013-02-17 21:22:05,0,0
303117430090260480,そしてバイト先のロッカーにて薬指を挟まれたのがまだ痛かったり。,149214651,一榎,ortensia266,2013-02-17 21:23:21,0,0
303117791312109569,故意だったんだけど、もう本触るだけで痛くてね。,149214651,一榎,ortensia266,2013-02-17 21:24:47,0,0
303118277515804672,禁書の前売はゲットしたし、カーニヴァルを買い直したし。,149214651,一榎,ortensia266,2013-02-17 21:26:43,0,0
303131232898785280,絶テンOPのBメロが好きだな。,149214651,一榎,ortensia266,2013-02-17 22:18:12,0,0
303131343188013056,私必ず浅沼さんのキャラ好きになるんだが。,149214651,一榎,ortensia266,2013-02-17 22:18:38,0,0
303131895619788800,そろそろ携帯ゲームやめようかな。でもKやテイルズは困るか。,149214651,一榎,ortensia266,2013-02-17 22:20:50,0,0
303494537530183680,明日はビズログとニャンコ先生のあんまん。,149214651,一榎,ortensia266,2013-02-18 22:21:51,0,0
303813525174898688,ニャンコ先生のあんまん手に入れた！,149214651,一榎,ortensia266,2013-02-19 19:29:23,0,0
303842601122033666,ニャンコ先生。 pic.twitter.com/vgwXFrN8,149214651,一榎,ortensia266,2013-02-19 21:24:56,0,1
303848861364015104,@a_kira24 ファミマだよ♪今日から数量限定発売だから早めに買った方がいいかな(^-^),149214651,一榎,ortensia266,2013-02-19 21:49:48,0,0
303850257811394562,@a_kira24 ぜひゲットして来て下さいっ！,149214651,一榎,ortensia266,2013-02-19 21:55:21,0,0
303854426945355776,あの漫画は立ち読みするべきやないと思ったけど、全部読みたいんだわ。,149214651,一榎,ortensia266,2013-02-19 22:11:55,0,0
303855203365560321,ニャンコ先生のあんまんは七辻屋の饅頭を食べてると思って食べました。,149214651,一榎,ortensia266,2013-02-19 22:15:00,0,0
303856274091683840,@a_kira24 栗入りのあんまんってことになってるけど、饅頭としか思えない食感でした(^ ^),149214651,一榎,ortensia266,2013-02-19 22:19:15,0,0
303858595521503232,@a_kira24 ざ、残念Σ（ﾟдﾟlll）数量限定で下の紙もニャンコ先生で120円だからなぁ(>_<),149214651,一榎,ortensia266,2013-02-19 22:28:29,0,0
303859583749857280,@a_kira24 それがいい！あんまんだけ買って見て楽しむでも満足出来るよ(^-^),149214651,一榎,ortensia266,2013-02-19 22:32:24,0,0
303864240039677952,明日こそはスタドラ観に行く！誰か行かないかな？？,149214651,一榎,ortensia266,2013-02-19 22:50:55,0,0
303891024265232385,スタドラ終わるの23時前とかwww入場者特典スガタなんだ…,149214651,一榎,ortensia266,2013-02-20 00:37:20,0,0
303891373529133056,アムネシアがケントルートって分かってたけど、うん…長いね。,149214651,一榎,ortensia266,2013-02-20 00:38:44,0,0
303902977675100162,えっ！不意打ちすぎる！トーマだっ♪,149214651,一榎,ortensia266,2013-02-20 01:24:50,0,0
303903302809174017,ていうか、ケント人気ないの？,149214651,一榎,ortensia266,2013-02-20 01:26:08,0,0
303903730955325440,ケントが2話だと思ってたから、絶テンの特典調べてたら文教堂が吉野ばっかりだわ！,149214651,一榎,ortensia266,2013-02-20 01:27:50,0,0
304218174591737856,こう煽られたら欲しくなる。,149214651,一榎,ortensia266,2013-02-20 22:17:19,0,0
304255353346994177,幼なじみがかっこよすぎで！ pic.twitter.com/qZvAvFcz,149214651,一榎,ortensia266,2013-02-21 00:45:03,0,0
304256356528029697,今日散々失敗したからマクドでセット買ったらなんか違ったんだけど、場所遠いから諦めた。,149214651,一榎,ortensia266,2013-02-21 00:49:02,0,0
304256464833359872,そしてスタドラも観るの諦めた。時間が時間でね。,149214651,一榎,ortensia266,2013-02-21 00:49:28,0,0
304257217232769024,仕事で失敗した上に新しいカバンが破れて本当に凹む。ビズログと執事様で癒されるしかないわ。,149214651,一榎,ortensia266,2013-02-21 00:52:28,0,0
304449699434356736,めっちゃ寝てしまってたww,149214651,一榎,ortensia266,2013-02-21 13:37:19,0,0
304456454105092096,さてアニメ消化しようかしら。,149214651,一榎,ortensia266,2013-02-21 14:04:09,0,0
304587741394501635,グレイセスは一昨日も昨日も寝落ちしてしまって、頑張って休みに進めてる。,149214651,一榎,ortensia266,2013-02-21 22:45:51,0,0
305570104270258176,入場者特典を絶対に手に入れたかったから昨日観てきた！ pic.twitter.com/anuxqDmyUQ,149214651,一榎,ortensia266,2013-02-24 15:49:24,0,0
305575925670617088,あとついでに昨日作ったもの。 pic.twitter.com/xmR17Z4MPE,149214651,一榎,ortensia266,2013-02-24 16:12:32,0,0
306053985469595650,白雪姫と七人の囚人たまたまメイトで見かけて買ったんだけどすごく好きな物語だった！,149214651,一榎,ortensia266,2013-02-25 23:52:11,0,0
307100489252741120,帰ってあれやこれやして風呂ったら寝落ちの二日間だったのよ。,149214651,一榎,ortensia266,2013-02-28 21:10:36,0,0
307100624544219137,もうあとちょっとでクリアするよ、グレイセス。,149214651,一榎,ortensia266,2013-02-28 21:11:09,0,0
307404673638350848,本店で食べた赤福美味しかった！ pic.twitter.com/z7TZ6mYMb2,149214651,一榎,ortensia266,2013-03-01 17:19:20,0,0
307442626016190464,@yukoyako 久しぶりに食べたよ、あんこ(^-^),149214651,一榎,ortensia266,2013-03-01 19:50:08,0,0
307470399040520192,山本くん好きだな。うん、多分仮面ライダーの頃からね。,149214651,一榎,ortensia266,2013-03-01 21:40:30,0,0
307922663261753344,ようやく雑誌片付けられた！,149214651,一榎,ortensia266,2013-03-03 03:37:38,0,0
308190722073448449,今日めっちゃテキパキやってたな。,149214651,一榎,ortensia266,2013-03-03 21:22:48,0,0
308191020951162882,まさかフロア任せられるとは思わなかったけど、思ったよりテンパらなかった。うん。,149214651,一榎,ortensia266,2013-03-03 21:23:59,0,0
308192144148008960,三連休して今日働いて、明日休みってなんか落ち着く(^-^),149214651,一榎,ortensia266,2013-03-03 21:28:27,0,0
308194333704740864,そういや引き替えて来たよ、キラフェスの。,149214651,一榎,ortensia266,2013-03-03 21:37:09,0,0
308196997846953984,知らなかったからspoon即買いしちゃったわ。猿美最強よ。,149214651,一榎,ortensia266,2013-03-03 21:47:44,0,0
308916182411522048,日曜日の白龍が可愛すぎたなぁと思いながら仕事してしまったww,149214651,一榎,ortensia266,2013-03-05 21:25:31,0,0
308917368669736960,REBORN!最終巻に、赤髪に、猿比古のポスカブックを手に入れてきたっ！,149214651,一榎,ortensia266,2013-03-05 21:30:14,0,0
309556036438728705,やっとパンケーキゲットした！,149214651,一榎,ortensia266,2013-03-07 15:48:05,0,0
310609828441645056,トーマゲットした！！,149214651,一榎,ortensia266,2013-03-10 13:35:28,0,0
310610210769223680,ケントのクリアファイル配布忘れてたけど、トーマは忘れなかったよ。,149214651,一榎,ortensia266,2013-03-10 13:36:59,0,0
310657703062147072,あっ、GHPに主人公とシンとトーマいる。めっちゃ小さいけど。,149214651,一榎,ortensia266,2013-03-10 16:45:42,0,0
311088062035800064,花粉のようで花粉ではなく、風邪だったせいか本当に体がだるい。,149214651,一榎,ortensia266,2013-03-11 21:15:48,0,0
311358012998684673,休憩時間に入って良平くんのTLで笑ってしまったわww,149214651,一榎,ortensia266,2013-03-12 15:08:29,0,0
311826211284332544,あかん。たまたま見つけたTLに笑ったww,149214651,一榎,ortensia266,2013-03-13 22:08:56,0,0
312168468315258880,二日続けてK関連買いまくってポストカード全部二枚ずつある。いや、猿だけ三枚だわ。,149214651,一榎,ortensia266,2013-03-14 20:48:57,0,0
312169504031506433,@homra_mikotosan こちらこそフォローありがとうございますっ！こちらも呼びタメ歓迎です！よろしくお願いします(^-^),149214651,一榎,ortensia266,2013-03-14 20:53:04,0,0
312174548831326209,@homra_mikotosan 失礼しました(>_<)あきなと読みます！,149214651,一榎,ortensia266,2013-03-14 21:13:07,0,0
312182656366424064,@homra_mikotosan 了解っ！私は何て呼ぼうかなぁ？,149214651,一榎,ortensia266,2013-03-14 21:45:20,0,0
312183845199966210,そういえば昨日UCの6弾を観てきた！,149214651,一榎,ortensia266,2013-03-14 21:50:03,0,0
312184695695745026,@homra_mikotosan やっさんいいかも！やっさんって呼びます(^-^),149214651,一榎,ortensia266,2013-03-14 21:53:26,0,0
312191439318687744,@homra_mikotosan よろしくーっ（≧∇≦）,149214651,一榎,ortensia266,2013-03-14 22:20:14,0,0
312218692060594176,イベのために内金全額してる今年。たくさん会う機会増やしてんなぁ。,149214651,一榎,ortensia266,2013-03-15 00:08:31,0,0
312933140505165828,仕事終わりにプラチナデータ観てきた！,149214651,一榎,ortensia266,2013-03-16 23:27:29,0,0
313115161068204032,今日はかっきーイベだね！,149214651,一榎,ortensia266,2013-03-17 11:30:46,0,0
313115242836152320,ということで、今向かってるよー。,149214651,一榎,ortensia266,2013-03-17 11:31:05,0,0
313156057885208576,かっきーめっちゃかっこよかった！,149214651,一榎,ortensia266,2013-03-17 14:13:17,0,0
313157634092048384,朝は京阪乗って、帰りは阪急にした。河原町に行きたかったし。,149214651,一榎,ortensia266,2013-03-17 14:19:32,0,0
313239269152006145,久しぶりに天王寺行ったけど、なんだかんだでホント一人行動でした。,149214651,一榎,ortensia266,2013-03-17 19:43:56,0,0
313507534285725696,誰か池袋に連れてってwwもう八犬伝のポスター写メりたい！,149214651,一榎,ortensia266,2013-03-18 13:29:55,0,0
313653296684466176,サンプル試してみよかな。,149214651,一榎,ortensia266,2013-03-18 23:09:07,0,0
315085478690947072,夜行観覧車気になる。最終回だけ見たいとかww,149214651,一榎,ortensia266,2013-03-22 22:00:06,0,0
315091902842142720,この頃、賢章くんイコールハリポタで定着してたな。,149214651,一榎,ortensia266,2013-03-22 22:25:38,0,0
315092693824966657,いぬぼく楽しみだわ！,149214651,一榎,ortensia266,2013-03-22 22:28:47,0,0
315401724791758849,@Linri1 遅くなりました(>_<)フォロバさせてもらいました！こちらこそよろしくお願いしますっ！,149214651,一榎,ortensia266,2013-03-23 18:56:45,0,0
315401991260106754,寒くなってきた。,149214651,一榎,ortensia266,2013-03-23 18:57:49,0,0
315402301332414464,チャリじゃないからなかなか目的地に着かない。,149214651,一榎,ortensia266,2013-03-23 18:59:03,0,0
315403346745909248,LUSHのイベントでいろいろ商品試したけど、こっちの方がやりやすいなー。,149214651,一榎,ortensia266,2013-03-23 19:03:12,0,0
315408651676430337,@Linri1 了解っ！こちらも呼びタメ歓迎です(^-^)あきなと読みますのでお好きに。,149214651,一榎,ortensia266,2013-03-23 19:24:17,0,0
315452974392553472,@Linri1 うん♪( ´▽｀),149214651,一榎,ortensia266,2013-03-23 22:20:24,0,0
316888937144676352,うーん、ちょっと風邪気味だなぁ。,149214651,一榎,ortensia266,2013-03-27 21:26:24,0,0
316889318541103104,アムネとサイコパスとロボノ最終回見た！,149214651,一榎,ortensia266,2013-03-27 21:27:55,0,0
316889935732940800,アムネ結局最後みんな喋ってくれなかったなー。,149214651,一榎,ortensia266,2013-03-27 21:30:22,0,0
316890226482114560,眼鏡ない方が宜野座さんかっこいいと思ったんだけど。,149214651,一榎,ortensia266,2013-03-27 21:31:32,0,0
317206818889809920,星入ってた。 pic.twitter.com/vE4kQsYs5W,149214651,一榎,ortensia266,2013-03-28 18:29:33,0,0
317275073058848770,喉痛んでるなぁ。鼻もヤバイけど、鼻より喉だなぁ。明日大丈夫かしら？,149214651,一榎,ortensia266,2013-03-28 23:00:46,0,0
317444261522075648,ううっ、声すら出ない。寒気するわ、汗出るわ、腹痛いわ。,149214651,一榎,ortensia266,2013-03-29 10:13:04,0,0
317614599522365442,もう完璧に寒いのか暑いのか麻痺してる。,149214651,一榎,ortensia266,2013-03-29 21:29:56,0,0
317923809996992512,バクマンとうとう終わったなぁ。,149214651,一榎,ortensia266,2013-03-30 17:58:37,0,0
317947191517929472,@Yucha_D こちらこそフォローありがとうございます(>_<)柿原さんかっこいいですよねー！ぜひ仲良くして下さい♪,149214651,一榎,ortensia266,2013-03-30 19:31:32,0,0
317947389778485248,@minake1024 フォローありがとうございます！フォロバさせてもらいました(^_^),149214651,一榎,ortensia266,2013-03-30 19:32:19,0,0
317947564999725056,昨日よりかは熱下がった。うん、あとはちゃんと治すことだね。,149214651,一榎,ortensia266,2013-03-30 19:33:01,0,0
318007578741321729,@Yucha_D こちらも呼びタメ大歓迎です！あきなと読みます。どんな風に呼んでもらってもいいですよー♪,149214651,一榎,ortensia266,2013-03-30 23:31:29,0,0
318016104691818497,@Yucha_D あきなとか、あきちゃんとかかな？好きなようにどうぞ♪,149214651,一榎,ortensia266,2013-03-31 00:05:22,0,0
318029859358130176,@Yucha_D うん、いいよぉ(#^.^#),149214651,一榎,ortensia266,2013-03-31 01:00:01,0,0
318357989893500928,中途半端な状態は何があるかわからんなぁと思う。,149214651,一榎,ortensia266,2013-03-31 22:43:54,0,0
318358391569395713,女の子の日まで来たからね。吐き気と貧血とも混ざったらなんでこうなるのかわかんないぐらい頭グラクラしてね。と、とりあえず言いたかったことを纏めてみた。,149214651,一榎,ortensia266,2013-03-31 22:45:30,0,0
318358788564455424,全員が全員、状態を知ってる訳やないし、知ることは出来ない。批難されても仕方ない訳だけども。,149214651,一榎,ortensia266,2013-03-31 22:47:04,0,0
318359605241581569,ここまで長く体調不良になったことないし、日常生活直したから直す部分ないし、となると原因は何だろうと思うんだわ。(女の子の日は確実にわかるけどね。)こっちが知りたい。,149214651,一榎,ortensia266,2013-03-31 22:50:19,0,0
318359890672373760,お見苦しいものごめんなさい(>_<),149214651,一榎,ortensia266,2013-03-31 22:51:27,0,0
318360748143288320,こういう時は呟くに限る。体調管理してない自分が一番悪いのは自分が一番理解してるわ。,149214651,一榎,ortensia266,2013-03-31 22:54:51,0,0
318361192659828736,けどな、これ普通の風邪じゃないよね…。ぶっちゃけ先週の火曜か水曜ぐらいからなんだよ。,149214651,一榎,ortensia266,2013-03-31 22:56:37,0,0
318362128987860993,貧血や頭痛だと原因わかってるし。前に話したから休む訳にはいかんと無理に行った方が実はダメだったんじゃ…と思ってまして。インフル疑惑…だと笑えない。,149214651,一榎,ortensia266,2013-03-31 23:00:21,0,0
318362535726292992,@Yucha_D 夏が待ち遠しいね！,149214651,一榎,ortensia266,2013-03-31 23:01:58,0,0
318367308693270528,@Yucha_D うんうん(>_<)EDは変わらず柿原に染めてもらえるとっ（≧∇≦）,149214651,一榎,ortensia266,2013-03-31 23:20:56,0,0
318370194118561794,@Yucha_D 歌っちゃえ！特典付けてね(>_<),149214651,一榎,ortensia266,2013-03-31 23:32:23,0,0
