tweet_id,tweet,user_id,user_name,user_screen_name,timestamp,retweets,favourites
21219767096446976,バイトだったけど、ストマの福袋の内容がよすぎた件。,149214651,一榎,ortensia266,2011-01-02 00:02:41,0,0
23317853176340480,@kanako1205 おっつー(*^◯^*),149214651,一榎,ortensia266,2011-01-07 18:59:44,0,0
23394654544203776,@kanako1205 会いたいー(#^.^#),149214651,一榎,ortensia266,2011-01-08 00:04:54,0,0
23395398915719168,写真を犬に変えてみたが、めっちゃ黒いw,149214651,一榎,ortensia266,2011-01-08 00:07:52,0,0
24734989425844224,見てるだけ、そこに留まるだけはもったいないよね。ずっと悩み苦しんでいたけど、もったいないことをしてるのは分かってるんだ。,149214651,一榎,ortensia266,2011-01-11 16:50:55,0,0
26626382750556160,今日ずっと出勤から退勤まで外で呼び込み、そして雪にいじめ…いやいや、雪に邪魔されながらチャリ押して帰宅した（泣）,149214651,一榎,ortensia266,2011-01-16 22:06:39,0,0
27034533090037761,長電話したけど、まず自分の愚痴に対する後悔が幼稚だと思った。次に、自分は何を覚悟してでも叶えたいんだということ。最後に、自分の目標や数字などを明確に出すこと。ウチ、いっぱいいろいろ言い合ったけど、大好きだ(>_<)いつも困った時、落ち込んでる時、教えてないのに電話してくれる！,149214651,一榎,ortensia266,2011-01-18 01:08:29,0,0
27679383997124608,すごくキツイ。精神的に参ってる。人を信じることが出来なくなりそう。ウチ笑う自信がない。笑えないや。,149214651,一榎,ortensia266,2011-01-19 19:50:54,0,0
27694446095114240,風邪だけやないけど、涙が止まらん。,149214651,一榎,ortensia266,2011-01-19 20:50:45,0,0
27707769624731648,もうそろそろ女の子の日だから余計に精神面があかんなぁ。,149214651,一榎,ortensia266,2011-01-19 21:43:41,0,0
27728917511016449,今日はノンノとミーナを買ってもた。まあ服の参考と付録目当てやけど、適当に着回しするよりかはいいっしょ！,149214651,一榎,ortensia266,2011-01-19 23:07:43,0,0
27804855833722880,リボコン買ったけど、見るのは明日かな。,149214651,一榎,ortensia266,2011-01-20 04:09:28,0,0
27989327896117248,スカートにしたかったけど、寒いからジーンズでいつも通り。,149214651,一榎,ortensia266,2011-01-20 16:22:30,0,0
28092472013889536,もこもこだった犬が綺麗さっぱりな犬に。爪も痛くない！暴れはするけど。,149214651,一榎,ortensia266,2011-01-20 23:12:21,0,0
28097703829307392,中国ってアトム人気なんだね。ニュースでやってた。,149214651,一榎,ortensia266,2011-01-20 23:33:09,0,0
28098777856344064,昨日見たIS、内山くんの声いいわ！屍鬼といい、ソウルイーターといい、良い役だよね！,149214651,一榎,ortensia266,2011-01-20 23:37:25,0,0
28124346614554624,松下くんのドラマなう。主題歌いいよね！,149214651,一榎,ortensia266,2011-01-21 01:19:01,0,0
28364679843676161,面接結果連絡来た(>_<)二つ受けといて良かった！これでしっかり計画立てられる。,149214651,一榎,ortensia266,2011-01-21 17:14:01,0,0
28412808823574529,接続のせいかmixi開けない…。という訳でTwitter活用。暇があれば呟くけど、精神的ダメージが思った以上にキツイ。マイミク全員悪いんじゃないし、今回のことだけやない。少し前からmixiである人の名前が出て来て、アクティビティとか、ボイスとか呟いてんの。正直見たくない。続く,149214651,一榎,ortensia266,2011-01-21 20:25:16,0,0
28414321683857409,じゃあマイミク切れよって話かもね。マイミク切って縁を切るか、長い年月かけて忘れるか。来る者拒まず去る者追わずがモットーやから、自分から切る気がない。これも逃げなんかな？とにかくmixiを毎度見ないようにしよ。だから、気にしちゃうんだ。来週からバイトかなり入るから暇ないしね。,149214651,一榎,ortensia266,2011-01-21 20:31:16,0,0
28463808901029888,@kanako1205 おかえり(^-^),149214651,一榎,ortensia266,2011-01-21 23:47:55,0,0
28466370261819392,ようやくバクマン。13話まで見たよ。昨日の時点でだけど。やっぱ最高の方が好き。漫画派やから、めっちゃ先読んでるけど、懐かしいなぁ。,149214651,一榎,ortensia266,2011-01-21 23:58:06,0,0
28744654807629824,なんかめっちゃ人多い(^_^;),149214651,一榎,ortensia266,2011-01-22 18:23:54,0,0
29083995446706176,電話かけ直したら席外されてるって。17時には掛かって来るかな？,149214651,一榎,ortensia266,2011-01-23 16:52:19,0,0
29086324950568961,今電話あった。とりあえずいろいろ用意しとかんとなぁ。,149214651,一榎,ortensia266,2011-01-23 17:01:34,0,0
29209094975918080,@asakuraayana せっかくなので(^-^)私は4年間マックバイトしてましたが、最初から5回までは先輩や店長付きっ切りで接客…主に挨拶、お辞儀、フロアの回り方、トイレ手入れのやり方→ドリンクとフルーリー作り→それからメニュー見つつ軽くレジになるのではないかと。頑張って！,149214651,一榎,ortensia266,2011-01-24 01:09:25,0,0
29295706380435456,見たさに負けて特典映像以外リボコン見た(^_^;)でも内容すごく良かった！勇気もらった！て訳で早いので寝る。,149214651,一榎,ortensia266,2011-01-24 06:53:35,0,0
29550712606171136,いい情報を仕入れてしもた。うん、悩む。今後考えるなら…でもチャンスではあるよね。,149214651,一榎,ortensia266,2011-01-24 23:46:53,0,0
29581692846997505,30分後に恋をします。いや、アニメのキャラに（笑）風早くんに(#^.^#)てか、ビクドンの鍋食べたい！テレビで見せられたら…,149214651,一榎,ortensia266,2011-01-25 01:49:59,0,0
29915479678132224,大分置いてた恋愛番長やったけど、なんか意外とおもろい。感じが他のと違うね。音楽好き！,149214651,一榎,ortensia266,2011-01-25 23:56:20,0,0
30012001488994305,恋愛番長サクサク攻略出来る。ちょっと前まで螺旋のように大変なゲームやってたしな(^_^;),149214651,一榎,ortensia266,2011-01-26 06:19:53,0,0
30606300647784448,ビクドン行ったけど、鍋じゃないのにした。友達がディズニーと池袋のメイトお土産くれた(^-^),149214651,一榎,ortensia266,2011-01-27 21:41:25,0,0
30950271261605888,豚キムチいいよね！,149214651,一榎,ortensia266,2011-01-28 20:28:14,0,0
31306662585303040,奈々ちゃんの本読破。なんか、改めて考えさせられた。,149214651,一榎,ortensia266,2011-01-29 20:04:24,0,0
31384621513965570,繋がりにくいなぁ(^_^;),149214651,一榎,ortensia266,2011-01-30 01:14:11,0,0
31385794442690561,ちょっとばかし明日本とか売りに行く。雪降るかなぁ？なんか自分に不必要なものを片付けてしまおうか計画実行するために。,149214651,一榎,ortensia266,2011-01-30 01:18:51,0,0
31392169981902848,売るもの見て改めて思う。めっちゃ重そう。売れたらいいけど、売れなかったらどうすっかな。,149214651,一榎,ortensia266,2011-01-30 01:44:11,0,0
31636110476058624,荷物重い（泣）,149214651,一榎,ortensia266,2011-01-30 17:53:31,0,0
31649985862828032,良かった。とりあえず全部売れた！めっちゃ軽い(^-^),149214651,一榎,ortensia266,2011-01-30 18:48:39,0,0
31650334837313536,@kanako1205 猫可愛い～(#^.^#),149214651,一榎,ortensia266,2011-01-30 18:50:02,0,0
31669290109239296,1円違いでもポイント有無だったら、ポイント選んでしまった(^_^;)まあ、買い物してないし、日用品だし。,149214651,一榎,ortensia266,2011-01-30 20:05:21,0,0
31672474777165824,今日すごく鞄が軽い(^-^)帰りにこんな軽いのは久しぶり！,149214651,一榎,ortensia266,2011-01-30 20:18:01,0,0
31704836202307585,明日今の職場で最後の仕事。短かったけど、結局思い出深い。まあ次も近場なんやけどね。,149214651,一榎,ortensia266,2011-01-30 22:26:36,0,0
31985249416122368,サイアク。めっちゃ満足感たっぷりでバイト終えたのに、ある店であるメンバーを発見してしもた。良かった、先に気づいて。,149214651,一榎,ortensia266,2011-01-31 17:00:52,0,0
32028028376719361,でも振り返ってみて、本当にいい職場やったなぁ。なんか元アルバイトの方がもっと仲良くなれそう。,149214651,一榎,ortensia266,2011-01-31 19:50:51,0,0
32028384070475776,とりあえず、ちゃんとエプロン返さないとね。あと冊子。今日は洗えるマスクとハンカチ買った(^-^),149214651,一榎,ortensia266,2011-01-31 19:52:16,0,0
32029179578941440,300均でマガジンラックに出会ってしもたんvv,149214651,一榎,ortensia266,2011-01-31 19:55:26,0,0
32039707856601088,漫画はジャンプ買ったけど、他なんも買ってない。,149214651,一榎,ortensia266,2011-01-31 20:37:16,0,0
32822033305829377,なんか上手く動いてくれんかったから呟けなかった…。明日は友達と神社行く(^-^),149214651,一榎,ortensia266,2011-02-03 00:25:57,0,0
33157476383727616,くじは出来なかったけど、少しだけカラオケ行った(^-^),149214651,一榎,ortensia266,2011-02-03 22:38:53,0,0
33174011479334912,パンナコッタってプリンみたいで、ゼリーみたいで、味はヨーグルト。,149214651,一榎,ortensia266,2011-02-03 23:44:35,0,0
33544203875258368,口内炎が治らない！ご飯食べにくい(>_<),149214651,一榎,ortensia266,2011-02-05 00:15:36,0,0
33696985336782848,もうちょっとしたら出なきゃ！,149214651,一榎,ortensia266,2011-02-05 10:22:42,0,0
33704993684987905,間に合うやろか…(^_^;),149214651,一榎,ortensia266,2011-02-05 10:54:31,0,0
33722504933548032,新曲ラッシュなう！今日はいっぱい歌うぞー！,149214651,一榎,ortensia266,2011-02-05 12:04:06,0,0
33728253894070272,なんかアニソンでもめっちゃ様々や(^-^),149214651,一榎,ortensia266,2011-02-05 12:26:57,0,0
33772050388619264,懐かしいのを歌いなう！,149214651,一榎,ortensia266,2011-02-05 15:20:58,0,0
33878377337192449,今日はすごく楽しかった♪久しぶりに歌うアニソンは思い出せなくて焦った(^_^;),149214651,一榎,ortensia266,2011-02-05 22:23:29,0,0
34166701511671808,全然計画立ててないっ(>_<)うわ、明日からではあるけど、まだ予定表もらってないから分からない！でもちゃんと立てとかないと。,149214651,一榎,ortensia266,2011-02-06 17:29:11,0,0
34174176021446656,ぽぽちゃん救急車のナレが神谷さんだった(>_<),149214651,一榎,ortensia266,2011-02-06 17:58:53,0,0
34291246063161345,体の調子が悪かったから、めっちゃ寝過ごしてしまった。,149214651,一榎,ortensia266,2011-02-07 01:44:04,0,0
34411589494902785,昨日寝過ぎて寝れないまま、初勤務だわ(^_^;),149214651,一榎,ortensia266,2011-02-07 09:42:16,0,0
34606426894639104,社員食堂あったよ。ごはんと照り焼きチキンで320円。ちょっ、安いけど外で食べちゃダメ…？しかもソフトバンクだけ電波入らないんやって（泣）,149214651,一榎,ortensia266,2011-02-07 22:36:29,0,0
34949428334829568,ひっさしぶりに雨に打たれたー（;￣O￣）,149214651,一榎,ortensia266,2011-02-08 21:19:27,0,0
35105614900363264,なんか朝から仕事した2日で、中途半端に仮眠して寝れない（笑）昨日、簡単なテスト受けて、レジやった！,149214651,一榎,ortensia266,2011-02-09 07:40:05,0,0
35285172748296193,やっぱ気持ち切り替えなあかんなぁ。けど、さすがにキツイ。信じてた人に裏切られた感じ。,149214651,一榎,ortensia266,2011-02-09 19:33:35,0,0
35288757192101889,スタドラに便乗して、青春を謳歌しななぁ。,149214651,一榎,ortensia266,2011-02-09 19:47:50,0,0
35309502379208704,mixiを再開してみた。メッセ返したり、ニュース見たりしただけやけど。やっぱ毎日見ないとあかんな。大事なメッセとかあるもんなぁ。,149214651,一榎,ortensia266,2011-02-09 21:10:16,0,0
35324746925080576,デュラ最新刊に、雑誌いくつか。あと、一目惚れの鞄。とりあえずは満足！,149214651,一榎,ortensia266,2011-02-09 22:10:50,0,0
35351540705267712,過去の後悔をしながら、またまた後悔するなう。やっぱ今と昔は違うよね。もう諦めるべきかな。,149214651,一榎,ortensia266,2011-02-09 23:57:18,0,0
35352885688672256,@kanako1205 ちょっとな、友達関係で落ち込みなうなの。,149214651,一榎,ortensia266,2011-02-10 00:02:39,0,0
35354088099024896,@kanako1205 ちなみにかなこが知ってる子。,149214651,一榎,ortensia266,2011-02-10 00:07:26,0,0
35357603156463616,@kanako1205 実はまなやねん。,149214651,一榎,ortensia266,2011-02-10 00:21:24,0,0
35375798009466880,@kanako1205 ごめん！長くなりそうやったから、メール送る！,149214651,一榎,ortensia266,2011-02-10 01:33:42,0,0
35381482847473664,@kanako1205 ダイレクトメッセージで送ってみたけど、届いたやろか？,149214651,一榎,ortensia266,2011-02-10 01:56:17,0,0
35385798916313091,そういえば、火曜日のNHKドラマに親が出てたんよね。めっちゃ分かりやすかったな。,149214651,一榎,ortensia266,2011-02-10 02:13:26,0,0
35637825013547009,特典で悩んだけど、諦めることにした。ソフマップにしよ。,149214651,一榎,ortensia266,2011-02-10 18:54:54,0,0
35706047280713728,あかん！はよ、風呂入らな(>_<),149214651,一榎,ortensia266,2011-02-10 23:25:59,0,0
35706274679103489,@kanako1205 電話出れんくてごめん！めっちゃ急いでて、気づかんかった(>_<),149214651,一榎,ortensia266,2011-02-10 23:26:53,0,0
35882891598770176,めっちゃ寒い。こんな雪の中、出なきゃならんのね…（泣）,149214651,一榎,ortensia266,2011-02-11 11:08:42,0,0
35907685874409472,まさかの腹痛で、行って早々トイレ。で、大事をとって早退させてもらった。ううっ、まだ痛い…,149214651,一榎,ortensia266,2011-02-11 12:47:14,0,0
35925960461254656,@kanako1205 ウチから相談しといてごめんな（；＿；）かなこからの厳しい言葉を貰わんとな。,149214651,一榎,ortensia266,2011-02-11 13:59:51,0,0
35968787496837120,テンパってたら、手の甲怪我した。最近こんなことばっかやな…,149214651,一榎,ortensia266,2011-02-11 16:50:01,0,0
36019609404575744,今年はかなり運が悪いのかもしれない。良く良く考えてはみたけど、さすがに落ち込むよ。,149214651,一榎,ortensia266,2011-02-11 20:11:58,0,0
36046104650842112,auのCMが嵐やなくて、春馬やった！うっわ、auやっぱええなぁ(>_<)auもう一度持ちたい！,149214651,一榎,ortensia266,2011-02-11 21:57:15,0,0
36046884665556992,君届良かったなぁ。修学旅行編の意識してる風早くん♡,149214651,一榎,ortensia266,2011-02-11 22:00:21,0,0
36067602425970688,見なかったことにしたい。とりあえず、せっかく気持ち切り替えるきっかけがあったんやから、しばらく忘れよ。別に羨ましいとか思ってないんだから！,149214651,一榎,ortensia266,2011-02-11 23:22:41,0,0
36087028877762561,@kanako1205 涙もろくなったんちゃう？（笑）,149214651,一榎,ortensia266,2011-02-12 00:39:52,0,0
36351110402945024,言いたいことははっきり言わないとすっきりしない。それが良く分かった気がする。ウチかなり控えめなんやなぁ。だからストレス溜まって、鬱になったんやな。,149214651,一榎,ortensia266,2011-02-12 18:09:14,0,0
36639499362648064,日曜日だね。と言ってみる。,149214651,一榎,ortensia266,2011-02-13 13:15:12,0,0
36780791488847872,乾燥したせいで、唇の皮が捲れて痛い…（泣）,149214651,一榎,ortensia266,2011-02-13 22:36:38,0,0
37162109078863872,気持ち切り替えしなきゃ！,149214651,一榎,ortensia266,2011-02-14 23:51:51,0,0
37162378374156288,ホワイトバレンタインになったね！,149214651,一榎,ortensia266,2011-02-14 23:52:56,0,0
37174621643997184,ジャンプ見て、山本！！としか連呼してへん（笑）さすが白蘭！信じてたよ！,149214651,一榎,ortensia266,2011-02-15 00:41:35,0,0
37476647250694144,ISの小説を読んでしまうぐらいハマってしもた。,149214651,一榎,ortensia266,2011-02-15 20:41:43,0,0
37478411165241344,リボコンBLUE楽しみ♪,149214651,一榎,ortensia266,2011-02-15 20:48:44,0,0
37660428754616320,@kobutar 京都住まいで、手先は器用な方ですが、一度もトーン貼りとかしたことないので戦力にならなさそう…。アシスタント興味はあるのに。読者として好きな作品ですが、きっと役に立てない(>_<),149214651,一榎,ortensia266,2011-02-16 08:52:00,0,0
37799591692869633,話は聞いてたけど、今初めてテレビで藤森神社の火事の話見た！元社務所らしいね。親が知り合いだと話が良く分かる、,149214651,一榎,ortensia266,2011-02-16 18:04:59,0,0
38262285050843136,小説読まなきゃ。アニメ見なきゃ。でも眠い。,149214651,一榎,ortensia266,2011-02-18 00:43:34,0,0
38409360648568832,やりたいこととやらなきゃいけないこと、なんか難しいよね。久しぶりにゲームから離れて、小説ばっか読んでる。,149214651,一榎,ortensia266,2011-02-18 10:27:59,0,0
38522452027904000,最近腹痛がひどい。寒さの影響なんやろか？,149214651,一榎,ortensia266,2011-02-18 17:57:22,0,0
38554049481547776,小説読んだり、好きなアニメやドラマ見たり、漫画読んだりすると、趣味だけど創作意欲が湧くんだよ。本当に趣味だから、これ以上は進まないけど。,149214651,一榎,ortensia266,2011-02-18 20:02:56,0,0
38630197649481728,決めた！かなりの数の本とCD類を売ろう。自分の参考になるもの以外を売るから…本棚スカスカになるかな？,149214651,一榎,ortensia266,2011-02-19 01:05:31,0,0
38923550345797632,初めて買取金額が万越えた(^_^;)あれでも寮は少なかったのになぁ。意外とレアやったんやな、あのCD。,149214651,一榎,ortensia266,2011-02-19 20:31:12,0,0
38964910675197952,今回の付録めっちゃ欲しかったサイズなんよ！ということで明日から使おうっ♪,149214651,一榎,ortensia266,2011-02-19 23:15:33,0,0
39081630975008769,リボコンBLUEとデュラララ!!9巻読みおえたら、朝だった。やっばい、寝よ。,149214651,一榎,ortensia266,2011-02-20 06:59:21,0,0
39304760452452352,やばい。腰痛ひどすぎ。,149214651,一榎,ortensia266,2011-02-20 21:45:59,0,0
39305020239253504,春キャベツ意外と上手い。,149214651,一榎,ortensia266,2011-02-20 21:47:01,0,0
39306910876450816,相変わらず弱っちいな、自分。,149214651,一榎,ortensia266,2011-02-20 21:54:32,0,0
39307726022639617,そいや、昨日のデカワンコ見てて、父に「お前はゴスロリ似合うな。けど、ゴシックな」だってさ。確かに過去に何回も着たがってたけど、モノトーンしか似合わないんも分かってるけど、高いんだよね。,149214651,一榎,ortensia266,2011-02-20 21:57:46,1,0
39350677377527808,ちょっと寝た。そして今からべるぜバブから朝の戦隊仮面などなどを見よう。,149214651,一榎,ortensia266,2011-02-21 00:48:27,0,0
40060839222321152,スタスカDVD良かったなぁ(#^.^#),149214651,一榎,ortensia266,2011-02-22 23:50:23,0,0
40361253905899520,LaLaを買った！黒にゃんこ先生のパスケースかわいい(>_<),149214651,一榎,ortensia266,2011-02-23 19:44:07,0,0
40716707383349248,寄ったマクドの店員にイラッとした。そして駅前のビラ配りのおっさんにも。,149214651,一榎,ortensia266,2011-02-24 19:16:34,0,0
41054111289843712,カフェで考え事するなんて、本当に珍しいや。,149214651,一榎,ortensia266,2011-02-25 17:37:17,0,0
41055888999456768,ホリーズで考え事しても纏まらず、やっぱり本屋で考えるなう。,149214651,一榎,ortensia266,2011-02-25 17:44:21,0,0
41067948994994176,遥か5のオーディションCD欲しさに買ったけど、中身が短い。さすがコーエー。映像見たいんやけど高い(^_^;),149214651,一榎,ortensia266,2011-02-25 18:32:16,0,0
41514457721081856,遥か5、結構いいかもとやってて思う。4はしてないけど。,149214651,一榎,ortensia266,2011-02-27 00:06:32,0,0
42533576159404034,サヨナラノツバサ見た！アルトがかっこいい！,149214651,一榎,ortensia266,2011-03-01 19:36:09,0,0
43120091063263232,喉痛めたんかな。血の味がしよる。,149214651,一榎,ortensia266,2011-03-03 10:26:45,0,0
43259002301321216,春馬と菅田くんの最強コンビ！,149214651,一榎,ortensia266,2011-03-03 19:38:44,0,0
43575130122752000,夢が一つ叶った！一番大きな夢はまだだけど、近いっちゃ近い！受けてみて良かった(>_<),149214651,一榎,ortensia266,2011-03-04 16:34:55,0,0
44003846565007361,遥か5は無事に全部クリアしました。て訳でストラバ続きやろ。,149214651,一榎,ortensia266,2011-03-05 20:58:29,0,0
44006887359922176,久しぶりのケーキは美味しかった♪,149214651,一榎,ortensia266,2011-03-05 21:10:34,0,0
44313963147698176,明日からすっごい楽しみだvv久しぶりな感覚。,149214651,一榎,ortensia266,2011-03-06 17:30:46,0,0
44676507355987968,今日から心機一転！めっちゃ楽しい！BGMが鈴なんだよ、エンドレスで。,149214651,一榎,ortensia266,2011-03-07 17:31:24,0,0
44723347908591616,楽しかった♪とりあえず、明日はマクロスFのアルバム買いに行く！,149214651,一榎,ortensia266,2011-03-07 20:37:31,0,0
44773473247170562,アバンティにアニメイトがってびっくり！働きたいけど今んとこもねぇ。,149214651,一榎,ortensia266,2011-03-07 23:56:42,0,0
45040774215249920,とりあえず、心機一転したんだから片付けないとね。,149214651,一榎,ortensia266,2011-03-08 17:38:52,0,0
45325919174406144,@kanako1205 おめでと！,149214651,一榎,ortensia266,2011-03-09 12:31:55,0,0
45326076196564992,電車早くこいこい！,149214651,一榎,ortensia266,2011-03-09 12:32:33,0,0
45330732440236032,今からバイトだ！,149214651,一榎,ortensia266,2011-03-09 12:51:03,0,0
45402711092502528,もうすぐ休憩終わり。アニメイト行ったから、ほくほく。,149214651,一榎,ortensia266,2011-03-09 17:37:04,0,0
45458834591985664,めっちゃ内容が分かる。,149214651,一榎,ortensia266,2011-03-09 21:20:05,0,0
45488266790699010,今日めっちゃ嬉しいことがあったん！もう、働けて良かったよ(>_<),149214651,一榎,ortensia266,2011-03-09 23:17:02,0,0
45872166356529152,煙草の煙も最近はダメみたい。めっちゃ鼻痛い。,149214651,一榎,ortensia266,2011-03-11 00:42:31,0,0
45960703336656897,飲み会なんて久しぶりに行ったけど、やっぱり慣れないなぁ。と、思った。,149214651,一榎,ortensia266,2011-03-11 06:34:20,0,0
45960962842439680,で、もう一つ。ようやくストラバ全クリした！明日は新約禁書読む。,149214651,一榎,ortensia266,2011-03-11 06:35:22,0,0
45961258750574592,ちなみに君に届け最新刊ゲットしたもんだから、めっちゃ和んだ(#^.^#),149214651,一榎,ortensia266,2011-03-11 06:36:32,0,0
46130543301099521,阪神大震災経験してるから、今回の地震は怖い。離れているとはいえ、従兄弟や友人がいるから心配(>_<),149214651,一榎,ortensia266,2011-03-11 17:49:13,0,0
46152489870958593,@Asa_naN あさなちゃんは大丈夫ですか？まだ余震が続いてるので気をつけて下さいね(>_<),149214651,一榎,ortensia266,2011-03-11 19:16:25,0,0
46155732252504064,@Asa_naN 良かった(>_<)私も阪神大震災経験してるので、怖いです！例え自分の地域じゃなくても心配になります。焦らず落ち着いて余震に気をつけて！,149214651,一榎,ortensia266,2011-03-11 19:29:18,0,0
46276641395179520,日本列島全部が津波警報や注意報になってる(>_<)関東ではないけど、すごく怖い。こういう時余計に寝れない。いつも寝てないけど。,149214651,一榎,ortensia266,2011-03-12 03:29:45,0,0
46280475538497536,ニュース見る度に痛い。自然が怖い。でももっと怖い思いを抱いてる人がいるの。関西淡路大震災の時に怖かったもん。,149214651,一榎,ortensia266,2011-03-12 03:44:59,0,0
46285706557014016,京都には来てないけど、滋賀まで今の地震来てる！怖くて寝れないよ(>_<),149214651,一榎,ortensia266,2011-03-12 04:05:47,0,0
46287724268883969,叔父の実家新潟なんやけど！もう、何処も心配です！,149214651,一榎,ortensia266,2011-03-12 04:13:48,0,0
