tweet_id,tweet,user_id,user_name,user_screen_name,timestamp,retweets,favourites
101288653082468353,@keiyama0209 マジか！！パクられたの？,343402110,瞬夏,shunka25,2011-08-10 22:47:51,0,0
101299434838691840,"@keiyama0209 久しぶりー！！
忘れたって…ウケる！！笑
え？じゃあ、まだチャリ見つかってない感じなの？笑",343402110,瞬夏,shunka25,2011-08-10 23:30:41,0,0
101303258735325184,"@keiyama0209 笑！！
そっかぁー！意外だよー、そういうの絶対忘れなさそうなのに！
学生最後の夏休みだからね。いっぱい遊びなね！笑
お酒は飲めるようになったの？",343402110,瞬夏,shunka25,2011-08-10 23:45:53,0,0
101314137379979264,"@keiyama0209 イイなー！遊びすぎてやばい！！って言えるくらい、あたしも遊びたい！！笑
ずっとコーラ飲んでるイメージがあるから、一緒に飲むとき笑っちゃいそうだよー。笑
たのしみにしてるねー！！",343402110,瞬夏,shunka25,2011-08-11 00:29:07,0,0
101890952624484353,@takapon_jp なゆ,343402110,瞬夏,shunka25,2011-08-12 14:41:10,0,0
102903181490667522,世間はお盆かぁ…なんだか季節感のない毎日を送ってるなぁ。笑  第一京浜も今日は車が少ない。,343402110,瞬夏,shunka25,2011-08-15 09:43:24,0,0
102903556239142913,夏だねー！ http://yfrog.com/hsbofdnj ,343402110,瞬夏,shunka25,2011-08-15 09:44:54,0,0
103872070278057985,考えられない“@yo_chan69: やめてくれよ @Aoi_2106ありえん… @Last_of_Operon: ディズニーランドで、福島ナンバーがガラス割られたり、スプレーで「帰れ」と落書きされたれりしている。お願いします。お願いです。福島を守って下さい。拡散してください。”,343402110,瞬夏,shunka25,2011-08-18 01:53:26,0,0
104070383447191552,風邪ひいたー！！いつもは龍角散と熱さまシートで治るけど、今回はそうはいかなそう…来週旅行だから、早く治したい！！,343402110,瞬夏,shunka25,2011-08-18 15:01:27,0,0
104070810662211584,とりあえず薬のんだし、休憩時間いっぱい眠ることにしよう。東方神起聴きながら、おやすみなさい…Zzz,343402110,瞬夏,shunka25,2011-08-18 15:03:09,0,0
104230395503054848,うん、今日もとても穏やかな気持ちで過ごせた。誰のおかげでしょうか。感謝しています。おやすみなさい。,343402110,瞬夏,shunka25,2011-08-19 01:37:17,0,0
104561447996108800,帰省中。さいたま新都心なう。あとちょうど一時間！！,343402110,瞬夏,shunka25,2011-08-19 23:32:46,0,0
104865580120678400,@yo_chan69 実家で見た！！,343402110,瞬夏,shunka25,2011-08-20 19:41:17,0,0
104867197746298880,@h_ototake 私も乙武さんの意見に同感です。それどころか、私は「100倍ってそうきたか！！」と、笑ってしまいました。そのツイートに悪意があるなんて、微塵も思いませんでした。,343402110,瞬夏,shunka25,2011-08-20 19:47:42,0,0
104867762245079040,あー淋しい。温かな実家でたくさんの愛情に触れると、東京へ帰るのがいつも淋しい。,343402110,瞬夏,shunka25,2011-08-20 19:49:57,0,0
105052805726875648,昨日のサッカーのニュース、本当に憤りを覚えた。聞き流すこともできるだろうけど、ちゃんと日本人としての思いを相手にぶつけてくれたGK川島は、本当に素晴らしいと思った。,343402110,瞬夏,shunka25,2011-08-21 08:05:15,0,0
105643134180016128,いよいよ明日！！…の、金沢旅行の準備なう。,343402110,瞬夏,shunka25,2011-08-22 23:11:00,0,0
105685010199228416,さて。だいたい準備も整いました。寝るとしますか、おやすみなさい。,343402110,瞬夏,shunka25,2011-08-23 01:57:24,0,0
107463293966364672,みんなの笑った顔ってすごくいいなと思った一日。すごく元気出た。また明日からがんばろうね、自分。,343402110,瞬夏,shunka25,2011-08-27 23:43:40,0,0
107765292549144576,きっと今が「大変」なのは、「大きく変わる」ときだから。,343402110,瞬夏,shunka25,2011-08-28 19:43:42,0,0
108782429833142272,@mabuco279 ママさま若ッ！！,343402110,瞬夏,shunka25,2011-08-31 15:05:27,0,0
109066742084550656,台風来るんだねΣ（ﾟдﾟlll）全然知らなかったよー。やっぱりテレビ買おうかな。,343402110,瞬夏,shunka25,2011-09-01 09:55:12,0,0
110368592037552128,@keiyama0209 ごめん、笑っちゃったよコーラのツイート！笑,343402110,瞬夏,shunka25,2011-09-05 00:08:17,0,0
110381873049505792,@keiyama0209 早！！笑 じゃあ今年の夏はマックでＬサイズコーラ飲みまくった？笑,343402110,瞬夏,shunka25,2011-09-05 01:01:03,0,0
110726089629896706,@0423mochi どーしたの？,343402110,瞬夏,shunka25,2011-09-05 23:48:51,0,0
110732733235466241,@yo_chan69 明日は朝から健康診断に行ったあと、金魚の展覧会に出かけるのよ！！すまぬ！！,343402110,瞬夏,shunka25,2011-09-06 00:15:15,0,0
110734636459638784,@yo_chan69 この間、AKB48の宮澤佐江ちゃんのブログに書いてあって、超行きたい！！ってなって、調べたのだよ( ´ ▽ ` ),343402110,瞬夏,shunka25,2011-09-06 00:22:49,0,0
111962825601200128,大規模停電が起こるんじゃないかと言われていた今夏、でも終わってみれば何ともなかった。本当に原発ってそんなにも沢山必要なのかと考えさせられた。,343402110,瞬夏,shunka25,2011-09-09 09:43:12,0,0
113411045422407680,@keiyama0209 おはよー！学生生活も残りわずかだねー！楽しんでね( ´ ▽ ` )ﾉ,343402110,瞬夏,shunka25,2011-09-13 09:37:54,0,0
117400356023050240,外苑前に降り立った途端、降り注ぐ太陽とカレーのいい香り。,343402110,瞬夏,shunka25,2011-09-24 09:50:00,0,0
117517535880032257,これから恵比寿で飲み！仕事がんばってる友達の話を聞くのが楽しみ！,343402110,瞬夏,shunka25,2011-09-24 17:35:38,0,0
136032901937627136,ミズノショップ / Xmasプレゼントを探しに、ミズノショップへ行ってきた。入り口の床が、キレイ。ホロスコープみたい( ´ ▽ ` ) http://my365.in/shunka25/p/228108 …,343402110,瞬夏,shunka25,2011-11-14 19:49:05,0,0
136033492638253056,結婚式 / いとこのシオリちゃんの結婚式へ出席してきた( ´ ▽ ` )しあわせになってね http://my365.in/shunka25/p/228165 …,343402110,瞬夏,shunka25,2011-11-14 19:51:26,0,0
136034030490624002,もこもこ。 / 買ったばかりのルームソックスをおろした。部屋着も同じもこもこ素材。グッスリ眠れますzzZ http://my365.in/shunka25/p/228208 …,343402110,瞬夏,shunka25,2011-11-14 19:53:34,0,0
171481642492362753,最近になって思うのだ。,343402110,瞬夏,shunka25,2012-02-20 15:29:44,0,0
171481785199366144,いい職場っていうのは、人に恵まれている環境をいうのだと。,343402110,瞬夏,shunka25,2012-02-20 15:30:18,0,0
193181863374893056,原宿プーマに、奥田民生なう。超似てるだけなのか、この人は。,343402110,瞬夏,shunka25,2012-04-20 12:38:40,0,1
193182867621294081,宣伝カーに群がる人、人、人。ってか、むしろ女。笑 pic.twitter.com/hCd2cXU7,343402110,瞬夏,shunka25,2012-04-20 12:42:40,0,0
193214868172713984,モスなう。新商品、おいしそうだなぁって思うのに、結局いつも決まってこれにしちゃうんだ。フィッシュバーガー。 pic.twitter.com/hGr1FoER,343402110,瞬夏,shunka25,2012-04-20 14:49:49,0,0
212076569206853633,"発売中のananの19ページの優子ちゃんかわいいー(´Д` )
あ、上の段の写真ね！",343402110,瞬夏,shunka25,2012-06-11 15:59:28,0,0
212078246072811520,そしてグラマラス86ページのこじはるがステキ過ぎる件(´Д` ),343402110,瞬夏,shunka25,2012-06-11 16:06:08,0,0
213815025285087232,明け方4時半頃まで寝れなくて、起きたらさしこのHKT電撃移籍！ビックリ。総選挙4位よりビックリ(´Д` )！！,343402110,瞬夏,shunka25,2012-06-16 11:07:29,0,0
213816382247276544,昨日のバイトで、上腕二頭筋が悲鳴をあげている。ううぅー(´Д` ),343402110,瞬夏,shunka25,2012-06-16 11:12:52,0,0
213818771167641600,@yo_chan69 時間があると、こっちにも手を伸ばせるのです。笑 しかし、最近つぶやいたことの全てがAKB関連っていう…まぁアレよね(´Д` )笑,343402110,瞬夏,shunka25,2012-06-16 11:22:22,0,0
213863719497777154,"@yo_chan69 あたし的にはグラマラスのこじはるがたまらなかったよー(´Д` )
まぁそのくらいヒマっていうやつよ。笑 あ、今度洋ちゃんに河西の生写真あげるね！あの「ここにいたこと」に同封されてたやつ！",343402110,瞬夏,shunka25,2012-06-16 14:20:58,0,0
215043121422151680,引越しの準備なう。こうしてると切実に人はいらないものばかりに囲まれて暮らしてるんだなーと実感。でも、人間の心を豊かにするのはその「要らないもの」なんだろう。要らないものっていうより、無くても平気なもの、かな。,343402110,瞬夏,shunka25,2012-06-19 20:27:30,0,0
215431234552205313,@YUKA8221 祐香ちゃんお誕生日おめでとう( *｀ω´) ,343402110,瞬夏,shunka25,2012-06-20 22:09:43,0,0
215633132626509824,今起きた( *｀ω´) 完全ダメ人間！あーゴミ収集車も行ってしまったー(´Д` ),343402110,瞬夏,shunka25,2012-06-21 11:31:59,0,0
215633533547458561,鈴木おさむさんのブログ読んだら、へルタースケルターがちょうだい！見たくなった！公開が待ち遠しいよー(´Д` )うーうー(´Д` ),343402110,瞬夏,shunka25,2012-06-21 11:33:35,0,0
215633986930741248,昔、２年半近く片思いしてた人の夢を見た。昔の自分じゃなく、今のじぶんで今のその人に向き合ってた。きっと彼は今も素敵なんだろうと思う。,343402110,瞬夏,shunka25,2012-06-21 11:35:23,0,0
215807347497517057,@ninagawamika 今、気になったのでゆうひさんの画像チェックして見ました！似ーてーるー(´Д` )！！びっくり。,343402110,瞬夏,shunka25,2012-06-21 23:04:15,0,0
215831079322529794,@kojiharunyan 今日、グラマラスのこじはる見たよー！同姓から見ても惚れ惚れでした。ステキだったー(´Д` )！おやすみなさい♬,343402110,瞬夏,shunka25,2012-06-22 00:38:33,0,0
215831135085805568,引越しの準備してたら、この本２冊出てきたー(´Д` )！最悪！２週間後に最新刊出るのに、３巻が２冊あるなんて！！ pic.twitter.com/7HJjzcVX,343402110,瞬夏,shunka25,2012-06-22 00:38:47,0,0
216009903624568832,@chara317megane 友人から聞いた話によると、コー◯ックすごい効くらしいですよ！一日トイレから出られないとか。日本はあんな危険な薬が誰でも買えるからすごい国だ！って、よく彼女は言ってます。笑,343402110,瞬夏,shunka25,2012-06-22 12:29:08,0,0
216124240661987330,えーっと、明日の朝７時に江戸球って…起きられるのか(´Д` )！？何時に家出たらいいのよ。６時前？笑,343402110,瞬夏,shunka25,2012-06-22 20:03:29,0,0
216177821628895232,@kyamizono うまそー！おなかすいたきたー！でも寝なきゃー(´Д` )明日朝早いのだ。,343402110,瞬夏,shunka25,2012-06-22 23:36:23,0,0
216178079842844674,@mariko_dayo 見れない…(´Д` ),343402110,瞬夏,shunka25,2012-06-22 23:37:25,0,0
216178709995065346,@kyamizono 笑！ごめん！確かに！笑 おやすみすー(´Д` )zzＺ,343402110,瞬夏,shunka25,2012-06-22 23:39:55,0,0
217053017873190912,YouTubeで、AKB48大家志津香の情熱大陸を見た。努力を怠らない人は好きだ。歯を食い縛って、生きてく人間が好きだ。また来年総選挙があったら、あたしはしーちゃんに入れたい。,343402110,瞬夏,shunka25,2012-06-25 09:34:06,0,0
217171686208966656,何にも悲観することはない。仲間に元気をもらって、これから家族のいる家に帰る、それで十分じゃないか。そう思える今が、とても大切に思えた。満足！,343402110,瞬夏,shunka25,2012-06-25 17:25:39,0,0
217242389646028800,"ヤバイ…(´Д` )
aikoのアルバムもおおきく振りかぶって19巻も森貴美子ちゃんの新刊も全部ほったらかしだなんて！
最近の余裕の無さがよくあらわれています(´Д` )",343402110,瞬夏,shunka25,2012-06-25 22:06:36,0,0
217250604148457472,"うーん…眠くなって来た(´Д` )zzZ
しかし、明後日は引越しだというのに、荷物が少ないなぁ。",343402110,瞬夏,shunka25,2012-06-25 22:39:15,0,0
217276512326529024,もはや引越しというより、パンダを積み重ねる作業…( *｀ω´) pic.twitter.com/4qxyoQyi,343402110,瞬夏,shunka25,2012-06-26 00:22:12,0,0
217277300088123392,@mabuco279 出産も子育てもしてないあたしにとって、すごーく勉強になる。まぶちゃんすげー！,343402110,瞬夏,shunka25,2012-06-26 00:25:19,0,0
217278171547054083,"@akimotooo726 二十日大根なら水で濡らしたティッシュの上に種を蒔けば、すぐに芽がでますよ( *｀ω´) ♬お家の中でできます。
初心者さんには、ゴーヤや大葉が育てやすくてオススメです。",343402110,瞬夏,shunka25,2012-06-26 00:28:47,0,0
217573459545427968,月が綺麗だよー。,343402110,瞬夏,shunka25,2012-06-26 20:02:09,0,0
217576647690424322,@kyamizono え？そんなことあったΣ（ﾟдﾟlll）？覚えてないや。,343402110,瞬夏,shunka25,2012-06-26 20:14:49,0,0
217578570720100354,@kyamizono 笑！何謝りだいΣ（ﾟдﾟlll）,343402110,瞬夏,shunka25,2012-06-26 20:22:28,0,0
217579403666931712,"@mabuco279 へー！周りも絶賛子育て中な子がいっぱいだけど、母乳事情まで聞いたことはなかったよ。勉強になりやす( *｀ω´) 
あした引越し！…の割には全然片付かないのよー。まいったね、コリャ。笑",343402110,瞬夏,shunka25,2012-06-26 20:25:46,0,0
217584326899019777,"@kyamizono 笑！！
カミカミ、そういやおっくん主催のビアガ行く？",343402110,瞬夏,shunka25,2012-06-26 20:45:20,0,0
217641656005050368,"あした引越しだから、職場に挨拶に行ったら、一番仲良くしてた方に頂きました(´Д` )
わーん！嬉しいー！ pic.twitter.com/HykrzTJc",343402110,瞬夏,shunka25,2012-06-27 00:33:09,0,0
217677359397093377,少し光が見え始めた。さて、明日は引越しだ( *｀ω´) ♬がんばろうっと。おやすみなさい。,343402110,瞬夏,shunka25,2012-06-27 02:55:01,0,0
217868382656151552,"あーいつまでたっても引越し屋が来ない(´Д` )
もう二度と頼むものか、◯カイ…(´Д` )
やはり◯リさんにお願いすればよかった…。",343402110,瞬夏,shunka25,2012-06-27 15:34:04,0,0
217901565539921920,山手線内で人を押しのけ角席を確保する、ゲーマーのおばやんに心のなかでザラキを唱える。,343402110,瞬夏,shunka25,2012-06-27 17:45:56,0,0
217902478170132480,しかも東京で座って秋葉原で降りるってΣ（ﾟдﾟlll）立っとけよ、おばやん！笑,343402110,瞬夏,shunka25,2012-06-27 17:49:33,0,0
217918634813685760,明日面接の会社の設立日が、自分の誕生日とおんなじだった。なんとなくいい予感！,343402110,瞬夏,shunka25,2012-06-27 18:53:45,0,0
217919639445979137,"10年って早いなぁー。もううちの高校が甲子園に出て10年経っちゃうんだ。
何よりも、みんな結婚してパパやママになってるのがすごい。
そんなこと10年前は想像出来なかったな。",343402110,瞬夏,shunka25,2012-06-27 18:57:45,0,0
217920154963689472,17歳のあたしは、ただただ野球に夢中だった。27歳のあたしは、家族といたくて自分で決めて実家に帰る。37歳のあたしは、…何してるんだろ？想像出来ないな( *｀ω´),343402110,瞬夏,shunka25,2012-06-27 18:59:48,0,0
217924556399185922,夕焼けきれいー！,343402110,瞬夏,shunka25,2012-06-27 19:17:17,0,0
217925622452858880,やっと小山！もう少し( *｀ω´) は,343402110,瞬夏,shunka25,2012-06-27 19:21:31,0,0
218012983715045378,いやいや美しすぎるでしょ、TSUBAKIのCMのエビちゃん…(´Д` ),343402110,瞬夏,shunka25,2012-06-28 01:08:40,0,0
218013645421031425,@kyamizono なぜに相田翔子？笑,343402110,瞬夏,shunka25,2012-06-28 01:11:18,0,0
218018062790688768,@kyamizono これは元祖嫁にしたいタレントよねあたしも好き,343402110,瞬夏,shunka25,2012-06-28 01:28:51,0,0
218250750013341696,@kyamizono 相田翔子がしゃべっているかのよう。笑,343402110,瞬夏,shunka25,2012-06-28 16:53:28,0,0
218665675735048192,@kyamizono どんな女と一緒にいるのさ！笑,343402110,瞬夏,shunka25,2012-06-29 20:22:14,0,0
219045814021001216,家庭教師のトライの、ハイジとコラボCMがシュールで面白い件。,343402110,瞬夏,shunka25,2012-06-30 21:32:46,0,0
219076282418343936,飛鳥井千砂さんの新刊を買った。サムシングブルー。読み終わったあと何を思うかな。楽しみです。,343402110,瞬夏,shunka25,2012-06-30 23:33:50,0,0
219191940657315840,賑やかな姪っ子に叩き起こされ、そういえば今日は「ボクらの時代」だったー！ありがとう、起こしてくれてー！笑,343402110,瞬夏,shunka25,2012-07-01 07:13:25,0,0
219837740362108928,最近芸能人の対談番組ばかり見てるなー( *｀ω´),343402110,瞬夏,shunka25,2012-07-03 01:59:36,0,0
219838590539145216,日曜日が蜷川実花と寺島しのぶと鈴木杏の「ボクらの時代」と東尾理子と樫木裕美の「アシタスイッチ」。そして今夜が徳井義実と星野源の「ゲストとゲスト」。,343402110,瞬夏,shunka25,2012-07-03 02:02:59,0,0
219838958652227584,誰かと誰かの思ってる事がぶつかり合ったり交わったり。全然育った環境も何もかも違うのに、共感したり興味を持ったり会話をしながらお互いの今までを交換するような感じが、やはりとても好きなのです( *｀ω´),343402110,瞬夏,shunka25,2012-07-03 02:04:26,0,0
219839287351443456,でも明日は面接やら派遣会社登録やらいろいろ盛りだくさんなので寝ます( *｀ω´) おやすみなさい。,343402110,瞬夏,shunka25,2012-07-03 02:05:45,0,0
219947798706139136,昔って、この20分がものすごく長く感じたのに、今はあっという間。一年一年が早く感じるのと同じ感覚なのでしょうか。…と、宇都宮に向かう電車内で思う。,343402110,瞬夏,shunka25,2012-07-03 09:16:56,0,0
220322893920350208,なんであんな夢を見たんだろう。今読んでる本の影響かな。,343402110,瞬夏,shunka25,2012-07-04 10:07:25,0,0
220331112327684096,杖をついてこれ見よがしに席を譲れと言わんばかりに前に立たれると流石に嫌な気分。世の中には優先席というものがあるんだから、そっちでアピールすればいいのに。と思いつつも席を譲ってしまう偽善なあたし。,343402110,瞬夏,shunka25,2012-07-04 10:40:05,0,0
220333907885830145,@kyamizono ねぇカミカミ、社長連絡先変えた？何か聞いてる？,343402110,瞬夏,shunka25,2012-07-04 10:51:11,0,0
221296363357487104,こんな時間にお腹空いちゃった(´Д` )寝るに限るな。,343402110,瞬夏,shunka25,2012-07-07 02:35:39,0,0
221561423459926018,めちゃイケ見ながら、ジャルジャルをしずると間違える。笑 髪の毛黒い方がいいと思うなー( *｀ω´),343402110,瞬夏,shunka25,2012-07-07 20:08:54,0,0
221634751226847232,しゃべってコンシェルのCMの神木くんの笑い方が川越シェフに見える件( *｀ω´),343402110,瞬夏,shunka25,2012-07-08 01:00:17,0,0
221635157512290305,やべぇ！保険証無くしたくさい！笑,343402110,瞬夏,shunka25,2012-07-08 01:01:53,0,0
222176647510638592,「幸せなときだけをいくらつないでも、幸せとは限らないのよ」かぁ。激しく納得。吉田修一さんの「初恋温泉」を読んでいます。,343402110,瞬夏,shunka25,2012-07-09 12:53:35,0,0
222270992704208896,HEY！HEY！HEY！なう。NMBのみるきーかわゆす(´Д` ),343402110,瞬夏,shunka25,2012-07-09 19:08:28,0,0
225168350467207168,微妙な天気。雷２回通過しました。強い雨が降ったおかげで、ちょっとだけ涼しくなりました( *｀ω´),343402110,瞬夏,shunka25,2012-07-17 19:01:32,0,0
225168508823150594,明日はへルタースケルター見にいこっと( *｀ω´) 楽しみすぎるるるー！！,343402110,瞬夏,shunka25,2012-07-17 19:02:10,0,0
225404197170974720,へルタースケルターなうたのしみー！ pic.twitter.com/X9umZNOI,343402110,瞬夏,shunka25,2012-07-18 10:38:43,0,0
225439112386187264,へルタースケルター観てきた！飲み物買って、一口も飲まずに終わったぜ！すごい映画だったー！もうアートの領域！,343402110,瞬夏,shunka25,2012-07-18 12:57:27,0,0
225452402298466304,@kyamizono えぇ、それはもう！！でもねー、なんかホント脱がないと不自然な映画でした。うまく言えないけど。女性のための映画という感想。こい！そんでもってもうアートな世界だった！,343402110,瞬夏,shunka25,2012-07-18 13:50:16,0,0
225453957856768000,"@kyamizono ぜひ観てきてー！！もうネタバレになるから言わないけど、見事でした、沢尻エリカ！！
あーーーー！かみかみ今日誕生日？あれ山ちゃん？昨日？どっちにしてもおめでとー♪(´ε｀ )",343402110,瞬夏,shunka25,2012-07-18 13:56:26,0,0
225454420467515392,@kyamizono 笑！かみかみは広末涼子と同じだったよね？広末涼子はいつだっけ？昨日？今日?,343402110,瞬夏,shunka25,2012-07-18 13:58:17,0,0
225455330128179200,@kyamizono そうか！それはすまなかった！あらためてお誕生日おめてまとうー( *｀ω´) ♬28歳かー！,343402110,瞬夏,shunka25,2012-07-18 14:01:54,0,0
226615212747399168,なるほど！→ 洋服の『女性のボタンが男性と逆に付いているのは男性が脱がせやすいから』と、和服の『着物の合わせが左前なのは男性が右手を胸元に入れやすいから』。ここから導かれる事は、欧米では『女性は正面から脱がすもの』、『日本では女性は後ろから脱がすもの』ということである。,343402110,瞬夏,shunka25,2012-07-21 18:50:51,0,0
227909371751972865,電車のなかってよく見ると変な人いっぱいいるよね。隣に座る横綱みたいな彼、鼻息荒いなーと思ってたら女だった！ごめんねてへぺろ,343402110,瞬夏,shunka25,2012-07-25 08:33:23,0,0
228863130355240960,オリンピック男子サッカー日本代表の,343402110,瞬夏,shunka25,2012-07-27 23:43:17,0,0
228863426288558080,大津くんがKABA.ちゃんに見える( *｀ω´),343402110,瞬夏,shunka25,2012-07-27 23:44:27,0,0
229015362946093058,眼科終了( *｀ω´) 帰って高校野球の中継を見ようっと。,343402110,瞬夏,shunka25,2012-07-28 09:48:12,0,0
229015754681487362,お医者さんに甘いものダメだって言われたけどシュークリームが食べたい。食べたすぎる(´Д` ),343402110,瞬夏,shunka25,2012-07-28 09:49:45,0,0
229034385528209409,オリンピックを見ていると、世界にはこんな国があったのかといつも驚かされる。いかに自分が狭い視野で生きているのかを実感。世界中の人の笑顔が素敵。,343402110,瞬夏,shunka25,2012-07-28 11:03:47,0,0
229088258473218048,テレビで高校野球見てます。基本的に名前が知れてる私学より、甲子園出場回数の少ない月光を応援するわたくしですが、日大三ってなぜか好き。がんばれー！,343402110,瞬夏,shunka25,2012-07-28 14:37:51,0,0
229105637806731264,なんという試合だ、西東京決勝！ドラマティック、これぞ高校野球(´Д` )！！ノーシードでよくここまであがってきた日大三を勝たせてあげたいー(´Д` ),343402110,瞬夏,shunka25,2012-07-28 15:46:55,0,0
229108386149564417,ひどい腫れだったのに、別のお医者様に行ったら抗生物質を出してくれて、すぐに腫れがひいてきました。回生眼科の山口先生ありがとう( *｀ω´),343402110,瞬夏,shunka25,2012-07-28 15:57:50,0,0
229212500950917120,ゆってぃ久々に見た(´Д` )！！笑,343402110,瞬夏,shunka25,2012-07-28 22:51:33,0,0
229228108023209984,福見がんばれー(´Д` )！！,343402110,瞬夏,shunka25,2012-07-28 23:53:34,0,0
229249267368333312,男子体操なう。アメリカは本当にダイナミックで男性的。日本はとても一つ一つの動きが丁寧で、時が止まったかのように感じる時がある。佇まいというか、その競技中に流れる空気が好き。,343402110,瞬夏,shunka25,2012-07-29 01:17:39,0,0
229378613156380672,体操男子の田中兄弟素敵すぎる( *｀ω´) ！,343402110,瞬夏,shunka25,2012-07-29 09:51:37,0,0
229393473030213632,宇都宮北工業の星くんの投球にしびれたー！！,343402110,瞬夏,shunka25,2012-07-29 10:50:40,0,0
