tweet_id,tweet,user_id,user_name,user_screen_name,timestamp,retweets,favourites
384682278879637505,毎日毎日頭の中をaikoの「September」が流れてた9月も終わり。この時期はいつも物悲しい。,343402110,瞬夏,shunka25,2013-09-30 23:12:56,0,0
384821250721206273,ものすごく懐かしい夢を見た。夢かわからないほどリアルな会話の内容で、起きてから今までの時間でもぐるぐる考え続けぐったり。あたたかいお茶を飲もう。,343402110,瞬夏,shunka25,2013-10-01 08:25:10,0,0
387952868000825345,最近めでたいこと続き。ほっこり( *｀ω´)♡,343402110,瞬夏,shunka25,2013-10-09 23:49:06,0,0
387953067981012992,小さなことにイライラするのは、信頼関係ができてない証拠だな(・ω・),343402110,瞬夏,shunka25,2013-10-09 23:49:53,0,0
408188196183236608,狂ったパン屋が、元気2000ポイント達成。それいけ！パン　http://douro.jp/crazy-bakery   ^_^わ、,343402110,瞬夏,shunka25,2013-12-04 19:57:04,0,0
409698755168837632,最近またしても仕事人間になってた。ヤバイ、ヤバイ近視眼。,343402110,瞬夏,shunka25,2013-12-08 23:59:29,0,0
409699164474187776,週末、一緒にいると元気になれる人と過ごせるって大切だなぁとしみじみ。野球の仲間、大好きな美容師の先輩、ずっと付き合っていきたい友達。あたしもそう思ってもらえるようにがんばろう。,343402110,瞬夏,shunka25,2013-12-09 00:01:07,0,0
409699525167570945,モヤモヤはいっぱいあるけど、それでも結果、無駄なものを省けたと思えばいいや。結果オーライで、今のあたしはすこぶる機嫌がいい。嫌な奴のことも、全部チャラにしちゃえー！…できないけど。笑,343402110,瞬夏,shunka25,2013-12-09 00:02:33,0,0
409699804847939584,そうそう、最近ストレスで肌の調子かわ悪い。サプリのビタミンB群とか、マルチビタミンの偉大さに気づく。…アラサーだなぁ。,343402110,瞬夏,shunka25,2013-12-09 00:03:39,0,0
412393100586139648,FBに芸能人の嫌な噂のリンクをわざわざ貼ってシェアする人がいる。何のためにするの？そういう人って、ムカつく仲間の悪口もシェアするんじゃないかと思って、うかつに心開けない気がしてしまう。,343402110,瞬夏,shunka25,2013-12-16 10:25:51,0,0
413486038514819075,猪瀬さん叩かれ過ぎ。あんなみっともない都議会、やってる方がなぜ恥ずかしいと思わないのか不思議。やることやらない人々より、多少金に汚くてもやることやってくれる人間のがよっぽどいい。責め立ててる人々に、人のこととやかく言う前にやるべき仕事をやってから言え、と言いたい。,343402110,瞬夏,shunka25,2013-12-19 10:48:48,0,0
416753695900979200,忘年会でナノケア当たった！やベー、今年の運を使い果たした気がする…(´Д` )ってことは、もう当たらないな、7000万は…orz,343402110,瞬夏,shunka25,2013-12-28 11:13:18,0,0
416754205064298496,湘南新宿ラインなう。高田馬場駅、ホーム乗り口に安全用のドアがついたんだね。久々通ってびっくり！,343402110,瞬夏,shunka25,2013-12-28 11:15:20,0,0
416932577543340034,@dj_futoshi そうか！師走の忙しさでネガティブになりすぎてた！笑 そんな考え方があったかー(´Д` )！！,343402110,瞬夏,shunka25,2013-12-28 23:04:07,0,0
416932730027270144,@yo_chan69 びっくりだよねー！思わず電車の中で立ち上がりそうになってしまったあたしです…(￣▽￣)笑,343402110,瞬夏,shunka25,2013-12-28 23:04:43,0,0
419447693182631936,パンサー見てると、一生懸命なバカっていいなーとほのぼの。あたしも2014年熱く元気に生きよう( *｀ω´)♫#イロモネア#パンサー,343402110,瞬夏,shunka25,2014-01-04 21:38:17,0,0
419746479683543040,「ぷよぷよ!!クエスト」をはじめたよ！ギルドをつくって一緒にあそぼう！アプリのインストールはここからできるよhttp://goo.gl/K32Jn ,343402110,瞬夏,shunka25,2014-01-05 17:25:33,0,0
419844906857680897,年末年始って完全に体調を崩し寝正月でした。無事に復活を遂げ、明日からの仕事にも行けそう。ちゃんと社会人としての義務は果たせそうでホッとしております。,343402110,瞬夏,shunka25,2014-01-05 23:56:40,0,0
419845126202994688,でも連休中日の式のスピーチがまだできてないー(´Д` )ぬおー(´Д` )！！,343402110,瞬夏,shunka25,2014-01-05 23:57:33,0,0
423243847930347520,ヤクルトのバレンティンが逮捕されたことよりも、彼が29歳だという事実のがよっぽど衝撃なんですけど…！！,343402110,瞬夏,shunka25,2014-01-15 09:02:51,0,0
424436454257729536,"年末年始体調崩してて、ようやく録画していた紅白を見た。
なんだかんだ一番あまちゃんが楽しかったしよかった。
綾瀬はるかの司会は…もういいかな。笑",343402110,瞬夏,shunka25,2014-01-18 16:01:51,0,0
424532368460771328,NHK Eテレの達×達なう。蜷川実花と渋谷慶一郎の対談。めっちゃいいな、こういうの好き。,343402110,瞬夏,shunka25,2014-01-18 22:22:58,0,0
426282020654690305,土曜日はすごくあたたかくなるんだとか。東京は16度だって。土手で野球の練習をしようっと。,343402110,瞬夏,shunka25,2014-01-23 18:15:28,0,0
426364123136282624,ガラスの仮面芸人マジウケる。笑 まだ連載してたんだー！白目の回数数えたスタッフさんの努力に乾杯！笑 #アメトーク,343402110,瞬夏,shunka25,2014-01-23 23:41:43,0,0
427677993230553088,土曜日の野球のせいで体が筋肉痛…。起きたけど負傷したベジータみたいな歩き方になってしまった。,343402110,瞬夏,shunka25,2014-01-27 14:42:34,0,0
428158034133532672,"旅モニ　Presented by TABI-MARCHE
毎月100名様を無料おためし泊へご招待！！応募はこちらから→
http://tabi-moni.com/ ",343402110,瞬夏,shunka25,2014-01-28 22:30:04,0,0
430161050596413441,あーついに2月。早いなぁ。きっと光の速さで今月もすぎるのだろう…。,343402110,瞬夏,shunka25,2014-02-03 11:09:21,0,0
430161266670198784,いろいろ楽しいことや予定が盛りだくさん。山ガールでもないのに、今週末はスノボ？スキーをしに行ってきます。…むしろ温泉だけでいい！,343402110,瞬夏,shunka25,2014-02-03 11:10:12,0,0
430161686603894784,最近ビタミンB群飲み忘れていたら吹き出物ハンパない…orz　年齢には逆らえないことを実感する今日この頃。お酒も飲めなくなってきたぜ。,343402110,瞬夏,shunka25,2014-02-03 11:11:52,0,0
431222141770428416,ソチ五輪日本代表選手のHPを見ていたら、フィギュア男子羽生くんの身長にビックリ。手足長くて顔も小さく見えるからてっきり180cmくらいなのかと思ってた。171cmなんだね。カメラ映えハンパない。　#羽生結弦,343402110,瞬夏,shunka25,2014-02-06 09:25:44,0,0
432460426366820352,あーやっぱり地元はいい。あーやっぱり地元がいい。,343402110,瞬夏,shunka25,2014-02-09 19:26:15,0,0
432853800060059649,@mabuco279 まぶちゃんやほー♡久しぶり！！下野市民なのだー！笑 でも生まれは小山だよo(｀ω´ )o出かけて帰ってくると、しみじみ感じる地元の素晴らしさ♡,343402110,瞬夏,shunka25,2014-02-10 21:29:22,0,0
432854207779966976,@yuya_hobby 8年ぶりにスノボやったらめちゃめちゃ楽しかったー*\(^o^)/*ウェアとボード買うー！！パウダー最高,343402110,瞬夏,shunka25,2014-02-10 21:30:59,0,0
433113201010429952,前の家が業者を呼んで住宅の洗浄をしてる。ジエット噴射のすごいやつ。一応、やってる家の周りにシートみたいのかぶせてるんだけど、うちの洗濯物に風に舞って落ちた泥が被ってる。やだなぁ。前の家も、業者も配慮が足りない。,343402110,瞬夏,shunka25,2014-02-11 14:40:08,0,0
436219120393007104,真央ちゃんがんばれ！ #オリンピック,343402110,瞬夏,shunka25,2014-02-20 04:21:57,0,0
436318862863134720,真央ちゃんショートでは残念だったけど、メダル云々かんぬんは置いといて、自分の納得いく滑りを目指してほしいな。五輪の舞台で失敗したからって、今までファンに与えてくれた夢や希望が色褪せるわけじゃない。がんばれ！　#浅田真央 　#ソチ五輪,343402110,瞬夏,shunka25,2014-02-20 10:58:17,0,0
436366659289239553,あーあーあーあーあー眠いーーー…明け方まで五輪フィギュアを見ていたのがたたっているぅぅぅう。みんなーオラに力をーーー！！！,343402110,瞬夏,shunka25,2014-02-20 14:08:13,0,0
446683399923589120,結局何が自分にとって一番いいのか、決めるのはいつも自分だっていうことだ。,343402110,瞬夏,shunka25,2014-03-21 01:23:16,0,0
446684452328984576,正直信じられないなと思う時もあるわけですよ。にんげんだもの。,343402110,瞬夏,shunka25,2014-03-21 01:27:27,0,0
446684601579089920,"あーだめだー、今日はダメな日だー。
疲れのせいにして寝てしまおう。おやすみなさい。",343402110,瞬夏,shunka25,2014-03-21 01:28:02,0,0
446788900371963904,@dj_futoshi 一晩明けたら少し落ち着いたよ。どうもありがとう( ´ ▽ ` ) フトシ(こう呼ぶの初！笑)のツイートに優しい気持ちを思い出させてもらいました。,343402110,瞬夏,shunka25,2014-03-21 08:22:29,0,0
447405384475484160,前髪切ったのです。春っぽくしたくて。一回でいいから、まわりがちょっと引くくらい短くしてみたいもんだ。栃木でやったらちょっと痛いコかな。仕事辞めたらやろう。30までにはやりたい…！,343402110,瞬夏,shunka25,2014-03-23 01:12:10,0,0
447406232899289088,来週、20年ぶりのお友達に会うのです。すごいな、よく今更会うことになったもんだ。Facebookすげー(・ω・)！,343402110,瞬夏,shunka25,2014-03-23 01:15:32,0,0
447406687402459136,一度出会ってしまった人とは、本当の意味での別れってないんだろうな。嬉しくも悲しくとも。だからいつになっても思い返したり、再会したりしてしまうんだね。,343402110,瞬夏,shunka25,2014-03-23 01:17:21,0,0
447407045101113345,いい思い出としての印象で残っている方が、よっぽどラクで、傷つけられたり、恨んだりしてる人の方が強烈に自分の中に残ってたりする。きっと、いい意味でも悪い意味でも一生忘れることなんかできないのだ。,343402110,瞬夏,shunka25,2014-03-23 01:18:46,0,0
447407366091186176,それが最近よくわかってきた。あたしもそうして自分がされたように気づかぬうちに誰が傷つけたりしてきたわけで。そうやってできてるんだね、この世界は。,343402110,瞬夏,shunka25,2014-03-23 01:20:03,0,0
447407510777892864,さーて、頭の中のいろいろを吐き出したところで寝よ。おやすみなさい。,343402110,瞬夏,shunka25,2014-03-23 01:20:37,0,0
461798566659248128,欲しいものにしか目が向かなくなって、思いやりとか、優しさを忘れてしまってるうちは、本当に欲しいものなんて結局手に入らないんだよ。,343402110,瞬夏,shunka25,2014-05-01 18:25:32,0,0
461798997854654464,そしてそれを手にして本当によ喜んでるときには、一緒に喜んでくれる人が誰もいないんだ。そういう風に、できてる。自分が誰かにしたことは、必ず自分に返ってくる。,343402110,瞬夏,shunka25,2014-05-01 18:27:15,0,0
461804617920020480,青山フラワーマーケット「花屋がつくったフレグランス」をプレゼント！ | 青山フラワーマーケット (Aoyama Flower Market) - Crocos懸賞 http://present.crocos.jp/86171?r=4db424db87d4beed4d00ca970e3e956a2c76b7e6&ref=tw … @crocos_presentさんから,343402110,瞬夏,shunka25,2014-05-01 18:49:35,0,0
463054476677361664,地震で目覚めました。でもこれから二度寝しようってんだから、日本人て地震に慣れてるよね。,343402110,瞬夏,shunka25,2014-05-05 05:36:05,0,0
463162811137286144,オリナスでyuraryさんという方のライブを見ました。ハナミズキのあとに歌っていた曲はなんだったんだろう…結婚式で使いたいな。,343402110,瞬夏,shunka25,2014-05-05 12:46:33,0,0
463672364127883264,@yurary_music 返信どうもありがとうございます！とても素敵な曲で、もう一度聴きたいなと思っていたのでとても嬉しいです！今、HPで聴き直しました！,343402110,瞬夏,shunka25,2014-05-06 22:31:20,0,0
463673223368818688,@yo_chan69 洋ちゃんお誕生日おめでとう！なんと！！10の位が変わりましたか！？変わらずファンキーなままでいてね(・ω・)♬あたしもすぐ10の位変わるから待ってておくれ！笑,343402110,瞬夏,shunka25,2014-05-06 22:34:45,0,1
464788938243469312,今日は職場で朝の一時間、メンディーの歌へたな話と釈由美子のスキップ下手な話で盛り上がる。なんて愛すべきふたり。,343402110,瞬夏,shunka25,2014-05-10 00:28:12,0,0
466250299917619203,ふぅー。いろいろ決まって来て少し落ち着いた。まずは第一関門突破！,343402110,瞬夏,shunka25,2014-05-14 01:15:08,0,0
467555280994058241,寝違えたのか、首が痛い。,343402110,瞬夏,shunka25,2014-05-17 15:40:40,0,0
478061825922048000,"楽天後藤ハンパない。
痺れるセーフティバント。",343402110,瞬夏,shunka25,2014-06-15 15:29:55,0,0
479416488831365120,女性都議に「産めないのか」　自民？議員席からヤジ（朝日新聞デジタル） - Y!ニュース http://headlines.yahoo.co.jp/hl?a=20140619-00000005-asahi-soci …,343402110,瞬夏,shunka25,2014-06-19 09:12:52,0,0
483416669545459712,職場でもらったデコポンゼリー、加工したなっしー！ pic.twitter.com/UG0lD4Jtax,343402110,瞬夏,shunka25,2014-06-30 10:08:10,0,0
483486215132282880,�N������� by yurary via #soundcloud https://soundcloud.com/yurary/7-1?utm_source=soundcloud&utm_campaign=wtshare&utm_medium=Twitter&utm_content=https://soundcloud.com/yurary/7-1 …,343402110,瞬夏,shunka25,2014-06-30 14:44:31,0,0
484362244151463936,飛鳥井千砂の「学校のセンセイ」を読んだ。飛鳥井千砂はいい。とてもすんなりと心に入ってくる。あたしの周りにもいるよ、溝口センセイも永野先生も、中川も、浅見も。おかげで大事なものが分かった。明日からまたがんばろ。,343402110,瞬夏,shunka25,2014-07-03 00:45:32,0,0
494115882130358272,好きなものと好きなものって、どこかでつながるようにできているのかも。,343402110,瞬夏,shunka25,2014-07-29 22:43:01,0,0
503429042893111296,宇都宮線なう。さいたま新都心でごっそり人がおりてゆく。そういえば職場の人がドリカムのライブ行くって言ってた！それでかぁー(^ ^)！,343402110,瞬夏,shunka25,2014-08-24 15:30:11,0,0
508107308245590016,このモヤモヤは土曜出勤にぶつけよう…(T_T),343402110,瞬夏,shunka25,2014-09-06 13:19:57,0,0
508285315094544384,怒ったり泣いたり、今日は疲れました。明日はゆっくり起きることにします。おやすみなさい。,343402110,瞬夏,shunka25,2014-09-07 01:07:17,0,0
511176765016784896,別に好きでもなんでもないけど、近づきたくなっちゃう人がいるように、その反対ですっごく好きだけど気軽に近づいていけないなって人もいる。まさにそれ。,343402110,瞬夏,shunka25,2014-09-15 00:36:52,0,0
516621913045479424,大変大変！コインの数が縁起よすぎ！明日はきっといい日になるなー*\(^o^)/* pic.twitter.com/G7ZmOwwmQM,343402110,瞬夏,shunka25,2014-09-30 01:13:57,0,0
516622131711328256,@nekozuki299 はっ！久々にTwitter開いたら引越しなのね！,343402110,瞬夏,shunka25,2014-09-30 01:14:49,0,0
516622580099194880,@yo_chan69 洋ちゃん、このお花みたいな不思議な食べ物はなんだね？,343402110,瞬夏,shunka25,2014-09-30 01:16:36,0,0
516723378481147904,@yo_chan69 ほうほう！そんな玉ねぎがこんなお花みたいになるんだね！すげー！見ても楽しいね！,343402110,瞬夏,shunka25,2014-09-30 07:57:08,0,0
516723920305545216,@nekozuki299 おはよー！なんと！茶の名産地に行くのかー！仕事ってことは、学生じゃなくなったの？,343402110,瞬夏,shunka25,2014-09-30 07:59:17,0,0
524201992151773186,政治家って馬鹿みたい。足の引っ張り合いはもうたくさん。誰も本当に日本のことなんて考えてないのがよくわかる。,343402110,瞬夏,shunka25,2014-10-20 23:14:28,0,0
527092907941965825,立教残念…神宮行くようになってもう11年かー。早いなぁ。優勝は来年の春を楽しみに待とう。池袋パレードなんて、想像するだけで泣けるな。泣くな、絶対。#東京六大学野球 #立教,343402110,瞬夏,shunka25,2014-10-28 22:41:56,0,0
527465486871568385,"うーん…(T_T)困った、風邪ひいたー。
土曜日はあっこちゃんの水の戯れ観に行くのにー！#菊池亜希子 #水の戯れ",343402110,瞬夏,shunka25,2014-10-29 23:22:26,0,0
528598980360294400,舞台を観て帰ってから4時間半…興奮して眠れない。そして考えてしまう。明子の気持ち、春樹の気持ち。うーん…(T_T)#水の戯れ #菊池亜希子,343402110,瞬夏,shunka25,2014-11-02 02:26:32,0,0
529296420189110273,明日で今シーズンの六大学野球も終わる。優勝したのは明治なのに、優勝を逃した立教と早慶の方がずっと心に残るシーズンだった。これは11年六大学野球を見てきて、初めての感覚だったな。感動をありがとう。#東京六大学野球,343402110,瞬夏,shunka25,2014-11-04 00:37:55,0,0
530979061749661697,怒ってる姿って、みっともないからあんまり人に見せたくないよね。哀れんでもらうのも嫌。,343402110,瞬夏,shunka25,2014-11-08 16:04:08,0,0
535454430313717760,今日一番のびっくりは、フックブックローのけっさくくんが40歳ということ。すごいなー。あんな40歳になりたい。オープニングのあの曲もけっさくくんが書いた曲なんだね。明日もがんばろー。ちょっと深呼吸〜*\(^o^)/*,343402110,瞬夏,shunka25,2014-11-21 00:27:39,0,0
549941874715152387,終電で栃木に帰るなんていつぶりだろう。いい一年でした。みなさん良いお年を。,343402110,瞬夏,shunka25,2014-12-30 23:55:35,0,0
