tweet_id,tweet,user_id,user_name,user_screen_name,timestamp,retweets,favourites
305559881417650176,これからどんどん人間関係が変わってくんだろうな。でも、それでも仕方ないというか、それがむしろ自然なんだと思う。,343402110,瞬夏,shunka25,2013-02-24 15:08:47,0,0
305561777268211713,菊池亜希子ちゃんと高良健吾くんて、なんか似てる。全体的な雰囲気が。,343402110,瞬夏,shunka25,2013-02-24 15:16:19,0,0
305823796529602560,雰囲気のある人が好きだ。これはなぜか昔から。今は、多部未華子ちゃんが気になる女優さん。,343402110,瞬夏,shunka25,2013-02-25 08:37:29,0,0
305973535963234304,今夜大地震きたらどうしよう(´Д` ),343402110,瞬夏,shunka25,2013-02-25 18:32:30,0,0
305975021619273728,電車なう。隣の人の香水がキツくて酔ってきてしまった(´Д` )うぅぅ…,343402110,瞬夏,shunka25,2013-02-25 18:38:24,0,0
305977340192751616,@Eriko_imai えりちゃんありがとう！びっくりしたけれど、大丈夫です。余震の頻度がすごいので、今夜は気をつけようと思います。,343402110,瞬夏,shunka25,2013-02-25 18:47:37,0,0
306341501066162176,彼が海外で働いているから目につくだけか、今年は海外で日本人が事件や事故に巻き込まれるのが多い気がする。,343402110,瞬夏,shunka25,2013-02-26 18:54:40,0,0
306548994677559297,ちえみと歩夢ちゃんから連絡が。気にかけてくれてありがとう。なんだかそれだけで気持ちが軽くなった。,343402110,瞬夏,shunka25,2013-02-27 08:39:10,0,0
306549727745425408,自分の痛みに敏感でなければ、他人の痛みにも気づけないって、昔誰かが言ってたな。,343402110,瞬夏,shunka25,2013-02-27 08:42:05,0,0
306550448763060224,ひとりでいる間にいろんな人の思いを知り、世界のことに目を向けるようになって、あたしは何か変わったのかな。,343402110,瞬夏,shunka25,2013-02-27 08:44:57,0,0
306574857620045824,分からないしうまく言えないけど、自分にとって何が大切か、よーく分かった。,343402110,瞬夏,shunka25,2013-02-27 10:21:56,0,0
306756020867330048,やっぱり、安心して日々暮らしているかそうじゃないかって重要。そう考えるとここ数ヶ月のあたしは、とてもギスギスしてた。,343402110,瞬夏,shunka25,2013-02-27 22:21:49,0,0
306771107447463936,"@yo_chan69 洋ちゃんやほー( *｀ω´) 
だって東京がすっかり遠くなっちまったんだもん。笑 ぜひ行きたいねー！",343402110,瞬夏,shunka25,2013-02-27 23:21:46,0,0
307121897554989056,世界イチバンなう( *｀ω´) ♬アイスランドいってみたいー♡,343402110,瞬夏,shunka25,2013-02-28 22:35:41,0,0
307482584730963968,NHKなう。テレビが映したスポーツ60年おもしろい。タイムマシンがあったら、未来よりも過去へ行って名勝負の数々を見たい。,343402110,瞬夏,shunka25,2013-03-01 22:28:55,0,0
307509043637919744,"おなかすいちゃったなー。
明日のあさまで我慢しよう、寝るに限る。",343402110,瞬夏,shunka25,2013-03-02 00:14:03,0,0
307509465350012931,評論しすぎる人は怖い。と最近思う。裏で自分も何か言われてそうで、ちょっとドキドキしてしまうのだ。,343402110,瞬夏,shunka25,2013-03-02 00:15:44,0,0
307644716520988672,電車が混んできてるのに、三人掛けのとこに二人＋荷物で使ってるバカ夫婦(推定年齢50代後半)。マナーが守れないなら立ってろ！,343402110,瞬夏,shunka25,2013-03-02 09:13:10,0,0
307660721469153281,さっきすごい嫌な感じで急にiPhoneの電源が落ちた。画面が血が滲んだみたいな、すごく嫌な色になってめっちゃ怖かった。何か嫌な予感。,343402110,瞬夏,shunka25,2013-03-02 10:16:46,0,0
309697242988687360,栃木へ帰って来て９ヶ月が経ちました。昨日、中学時代の友人とらんちしたんだ( *｀ω´) みんなママになってて、もう言葉に言い表せないくらいあたたかな気持ちになって、止まってた時間が動き出した気がした。やっと、「栃木に帰ってきたんだ」と実感した。,343402110,瞬夏,shunka25,2013-03-08 01:09:11,0,0
309697519091347457,最近ね、お金は持っているに越したことないけど、欲しいものは全然買えないなぁって思う。お金で買えるもので欲しいものはなかなかない。,343402110,瞬夏,shunka25,2013-03-08 01:10:17,0,0
309697723274248193,あの人と過ごす時間も、思い描く幸せも、心の穏やかさも、全部お金じゃ買えないんだ。,343402110,瞬夏,shunka25,2013-03-08 01:11:05,0,0
310182671529701376,東京ひさしぶり( *｀ω´),343402110,瞬夏,shunka25,2013-03-09 09:18:06,0,0
311622978725109761,急に椎名林檎ちゃんの「落日」が聴きたくなる朝。,343402110,瞬夏,shunka25,2013-03-13 08:41:22,0,0
314158448784846848,メガネ男子が好きなわけではないですが、侍JAPAN帰国会見の井端のメガネ姿には本気で心持ってかれたよね。,343402110,瞬夏,shunka25,2013-03-20 08:36:25,0,0
314158745615736832,最近思うんだよね、人に会いたくないとか、こんな自分で会っても周りに迷惑だとか、あたしもそういう経験あるけど。大抵は自分から誰かを勝手に遠ざけている。,343402110,瞬夏,shunka25,2013-03-20 08:37:36,0,0
314158883411206144,一回は手を差し伸べるけど、そのあとはもう知らない。だって子供じゃないんだもん。,343402110,瞬夏,shunka25,2013-03-20 08:38:09,0,0
314512725814419456,後ろに立ってるおっさんがうるさい(´Д` ),343402110,瞬夏,shunka25,2013-03-21 08:04:11,0,0
314701732959621120,ホント、仕事ばっかやってて腐ってるんだよね。仕事なんてクソ食らえだ！！,343402110,瞬夏,shunka25,2013-03-21 20:35:14,0,0
314944111562076160,仕事は人それぞれでいいと思う。こんなにたくさんの仕事があるんだから。,343402110,瞬夏,shunka25,2013-03-22 12:38:22,0,0
314944346912878595,雇用形態も場所も時間も、その中から自分の望む形に近いものを選べばいいと思うし、誰もそれを責めなくていいと思う。,343402110,瞬夏,shunka25,2013-03-22 12:39:18,0,0
315830205329575936,法事にいってきました。家族っていいなと思った日曜日でした。,343402110,瞬夏,shunka25,2013-03-24 23:19:23,0,0
315831018357673985,歳をとってから上手になることと、下手になることがある。,343402110,瞬夏,shunka25,2013-03-24 23:22:37,0,0
315967867101249537,"宇都宮線なう。何やら車内で揉め事のよう。
姿は見えませんが、おっさん激怒り。笑",343402110,瞬夏,shunka25,2013-03-25 08:26:24,0,0
320554834635939841,結婚は、いろいろ見えすぎていないうちにする方がいいのかもしれないと最近思う。,343402110,瞬夏,shunka25,2013-04-07 00:13:22,0,0
320927189736493057,自分にとって大切なことだから迷ったり悩んだりするのです。,343402110,瞬夏,shunka25,2013-04-08 00:52:59,0,0
322009080598261762,明日目が覚めなかったらどうしよう、とか思うよね。怖いわ、ミサイル。,343402110,瞬夏,shunka25,2013-04-11 00:32:02,0,0
322010617865199616,リアルに幸せってなんだろうレベル。もういろいろさっぱり分からん。,343402110,瞬夏,shunka25,2013-04-11 00:38:08,0,0
324862031834533889,おもしろいなー「君に届け」。あたしもいつも悩んでたわ、どうしたら相手を大事にできるのかが分からなくて。,343402110,瞬夏,shunka25,2013-04-18 21:28:38,0,0
324902177686552576,話してもムダだ、とか思い始めたらおしまいかしら。,343402110,瞬夏,shunka25,2013-04-19 00:08:10,0,0
325810758174793728,舟を編む 見に行きたい…(´Д` )GW明けまでやってるのだろうか。,343402110,瞬夏,shunka25,2013-04-21 12:18:32,0,0
327046750063964160,キスマイの「キレイな肌が、もったいないぞ」シリーズのCMを見ると、ぞわーっと恥ずかしい気分になるのはあたしだけでしょうか…(´Д` ),343402110,瞬夏,shunka25,2013-04-24 22:09:56,0,0
327057570923696128,今週の金曜日はひとみちゃんとごはん(´Д` )♡そのために仕事がんばるじぇ！！,343402110,瞬夏,shunka25,2013-04-24 22:52:56,0,0
329985619583455232,高校時代の友人から入籍の連絡が来た。全然会わなくても、全然連絡を取り合っていなくても、繋がってると思える不思議な関係。,343402110,瞬夏,shunka25,2013-05-03 00:47:57,0,0
329985825788022784,京都で親族だけの式をあげるそうだ。なんとも彼女らしい。いつまでもふたりが、幸せな時間を過ごせますように。,343402110,瞬夏,shunka25,2013-05-03 00:48:46,0,0
330481167704915968,隣のオヤジが酒臭い(´Д` ) ザラキ！笑,343402110,瞬夏,shunka25,2013-05-04 09:37:05,0,0
334809512588505090,宇都宮線激混み！でもこんなん、京浜東北や山手線のラッシュから比べたらたいしたことないわ。,343402110,瞬夏,shunka25,2013-05-16 08:16:22,0,0
334810624586547200,それに比べ、この程度で「乗れなくない！？」とか騒ぎすぎな田舎の高校生。,343402110,瞬夏,shunka25,2013-05-16 08:20:48,0,0
336503221608652800,もう別にいいんだよね。一緒にいるとかいないとか。ただただ生きていてくれさえすれば。,343402110,瞬夏,shunka25,2013-05-21 00:26:34,0,0
341176544103899137,以前買ったことのある漫画を、またしても買ってしまった(´Д` )！じーざす！,343402110,瞬夏,shunka25,2013-06-02 21:56:41,1,0
341925950348488704,惣領冬実の「MARS12巻」、あいざわ遥の「リネンとガーゼ3巻」、谷川史子の「おひとり様物語4巻」…いずれも家に2冊ずつあります。,343402110,瞬夏,shunka25,2013-06-04 23:34:33,0,0
343168045293912065,"家のそばの踏切で止まってた車から男が出てきて、車の汚れをティッシュで拭いた。それをそのまま外にポイ…。
マジお前死ね(´Д` )！！",343402110,瞬夏,shunka25,2013-06-08 09:50:12,0,0
343258462630846464,先週録画しといたパラキス見ております。一番しっくりきてるのって、イザベラ役の五十嵐くんだな( *｀ω´),343402110,瞬夏,shunka25,2013-06-08 15:49:29,0,0
343259506400174080,でも、北川景子より栗山千明のが紫のイメージだったなー。むしろ、実和子役の大政絢のが紫かも。,343402110,瞬夏,shunka25,2013-06-08 15:53:38,0,0
343325073102495745,"れなちゃん7位おめでとうー(´Д` )
ぐはー！かわいいー！",343402110,瞬夏,shunka25,2013-06-08 20:14:10,0,0
344814775768866817,テレビがつまらん(´Д` )寝よ。,343402110,瞬夏,shunka25,2013-06-12 22:53:43,0,0
346641824313638915,髪の毛が重たい。切りたい、切りたい。,343402110,瞬夏,shunka25,2013-06-17 23:53:45,0,0
348456322695569408,あしたはaikoのチケット発売！電話つながりますように！,343402110,瞬夏,shunka25,2013-06-23 00:03:55,0,0
349158353672499201,しゃべくりウケるー(´Д` )！,343402110,瞬夏,shunka25,2013-06-24 22:33:33,0,0
349182404004548608,最近すごい昔のこと思い出すんだ。とてもいい感じで、久々に詩を書いた。寝よー。,343402110,瞬夏,shunka25,2013-06-25 00:09:07,0,0
349537514954047488,辛坊さんに対して自民が批判なんちゃらってニュース出てたけど、本当口で人のこと攻撃してる暇があるなら、国民に夢を持たせてみろよ！って言いたい。,343402110,瞬夏,shunka25,2013-06-25 23:40:12,0,0
349881991187021824,あー雨の音が心地いい。,343402110,瞬夏,shunka25,2013-06-26 22:29:01,0,0
349882082916433922,"少し疲れたのです。
寝るのです。",343402110,瞬夏,shunka25,2013-06-26 22:29:23,0,0
350273409390886915,@yo_chan69 見たー！やっぱ帝王にしきのはさすがだったね♡笑わせてもらったー！,343402110,瞬夏,shunka25,2013-06-28 00:24:23,0,0
350632770583789568,よくTVとかもちろん友達とかでもいるけど、「太ってる人が嫌い」とかいう奴。よくわかんない。だって太ってるか違うかなんて事で人のこと測ったことないもん。,343402110,瞬夏,shunka25,2013-06-29 00:12:21,0,0
350633145068044289,太ってる人によりたくさん嫌がらせでもされればそういう気持ちにもなるんだろうけど、そんなことされたことない。むしろ、親切にばかりされる。そういうこと言う人って、よっぽど嫌な人に当たっただけなんだろうな。もし違ければ納得するよう説明してみてほしい。,343402110,瞬夏,shunka25,2013-06-29 00:13:50,0,0
350634191764979714,結論。友達は選ぼう。,343402110,瞬夏,shunka25,2013-06-29 00:18:00,0,0
350634682309808130,@yo_chan69 あの堅く私たちの期待に応える姿勢、もう完全に生きるレジェンドだよね。笑 帝王見てたらめっちゃ元気出たので、７月もがんばろうって思った！,343402110,瞬夏,shunka25,2013-06-29 00:19:57,0,0
350636435939930114,@yo_chan69 あれホントDVDにしてほしい！ソッコー買うよー(´Д` )！10年後も笑う自信あり！そうだー！久しく会ってないじゃんよー！元気なの？,343402110,瞬夏,shunka25,2013-06-29 00:26:55,0,0
350829843610472448,今日のあたしは機嫌がいい〜♬なぜなら髪型がうまくいったから〜♬,343402110,瞬夏,shunka25,2013-06-29 13:15:27,0,0
350830169650499584,@yo_chan69 あのシリーズこそ神だよね！ ちなみにあたしは今、洋ちゃんもご存知の地元のでっかい病院で働いてるー！,343402110,瞬夏,shunka25,2013-06-29 13:16:45,0,0
350857908927463426,宇都宮を出てくるときはあんなに曇っていたのに、南下すればするほど青空が広がって来た。今日はこれから成田空港へ行くのだ。,343402110,瞬夏,shunka25,2013-06-29 15:06:58,0,0
350893390004621312,"よかった。
無事に着いた。",343402110,瞬夏,shunka25,2013-06-29 17:27:58,0,0
358806189112426496,とちぎテレビで高校野球観戦なう。烏山高校の野球、好きだなー。,343402110,瞬夏,shunka25,2013-07-21 13:30:36,0,0
360063674326593536,甲子園への道、見てました。霞ヶ浦ナインの手をつないで輪になる様子に、小山西の「ふれあい野球」を思い出して重ねてしまった。,343402110,瞬夏,shunka25,2013-07-25 00:47:24,0,0
360065531908329472,ロイヤルベビーに大盛りあがりの英国ですが、海外ってつくづく退院早いよね。日本はやはり何かと手厚い…。,343402110,瞬夏,shunka25,2013-07-25 00:54:47,0,0
360317793524125697,各地で熱戦が繰り広げられてる甲子園への予選ですが、地元栃木はベスト４すべてが私立…(´Д` )もうどこがいってもいいよ！笑,343402110,瞬夏,shunka25,2013-07-25 17:37:11,0,0
360318242125918208,そして神奈川は期待の桐光学園、松井くんが敗れてしまったという…(´Д` )彼を見たかった野球ファンは泣いてることでしょうよ。,343402110,瞬夏,shunka25,2013-07-25 17:38:57,0,0
360594947038126080,ときめきトゥナイトの新刊とか超絶ヤバいよね。職場のお姉さんと、朝から真壁俊がいかにカッコいいかで盛り上がる。,343402110,瞬夏,shunka25,2013-07-26 11:58:29,0,0
360595209542836226,セーラームーンとか、幼いころに夢中になった漫画って、きっと今読んだ方がいろいろ感じるものも違うんだろうなー。,343402110,瞬夏,shunka25,2013-07-26 11:59:32,0,0
360595559754629120,気づいたら来週はもう8月なんだねー…早！！,343402110,瞬夏,shunka25,2013-07-26 12:00:55,0,0
360599870484123648,もう朝から尋常じゃないテンションの上がり方なので改めて載せる！笑「ときめきトゥナイト」15年ぶり新刊「真壁俊の事情」発売（コミックナタリー） - Y!ニュース http://headlines.yahoo.co.jp/hl?a=20130726-00000005-nataliec-ent …,343402110,瞬夏,shunka25,2013-07-26 12:18:03,0,0
360784718385520642,とんでもねぇ雷雨なう。,343402110,瞬夏,shunka25,2013-07-27 00:32:34,0,0
361627565741441024,キタ―！直接対決！！春子vs太巻！！#あまちゃん,343402110,瞬夏,shunka25,2013-07-29 08:21:45,0,0
364016613420302337,二十四の瞳を見ています。数ある戦争を描いた物語の中でも、何度も何度も繰り返し読んだ。大事な人が国のために命を捧げなくていい、今の時代を守って行きたいとあらためて思った。,343402110,瞬夏,shunka25,2013-08-04 22:34:58,0,0
364017558342479873,二十四の瞳の大石久子みたいに、あたしにも学生時代にとことん向き合ってくれた先生がいる。学生時代にたくさんの愛情をもらったけど、大人になった今、それを返したいと本気で思う。,343402110,瞬夏,shunka25,2013-08-04 22:38:43,0,0
365282747377393664,甲子園ってきょう開幕なんだ！明日からだと思ってた！あたしとしたことが！,343402110,瞬夏,shunka25,2013-08-08 10:26:08,0,0
365283019004719104,日本文理頑張ってほしいなー。相手が大阪桐蔭だけど、ぜひ勝ってくれ！2009年の決勝は忘れられない。,343402110,瞬夏,shunka25,2013-08-08 10:27:13,0,0
368186771994996736,お盆らしいことできていないから、明日はお線香あげにいこう。でも、仕事のおかげでこの唸るような暑さを病院の安全な冷房の部屋で過ごせている。ありがたや、仕事。,343402110,瞬夏,shunka25,2013-08-16 10:45:41,0,0
368187118167683072,そして、先生方も甲子園大好き！！なおかげで仕事中にも関わらずNHK見まくり。さすがにひとりのときは見てないけど、最高にありがたい職場です。,343402110,瞬夏,shunka25,2013-08-16 10:47:04,0,0
368187407536902145,そうそう。くらもちに誕生日プレゼントでもらった冷却ジェルシートのおかげで、この夏は寝苦しさ知らず。最強に重宝しています。ありがとう。,343402110,瞬夏,shunka25,2013-08-16 10:48:13,0,0
368187799830142976,高校野球ってホントおもしろいよなー。高校野球で感動しなくなったら、自分「野球ファンです」って言うのやめるね。#高校野球,343402110,瞬夏,shunka25,2013-08-16 10:49:46,0,0
368188204161069056,栃木県民のワタクシですが、栃木の県予選を見ているとよく分からない作新学院の強さが、全国の舞台に行くと際立つから不思議。#高校野球,343402110,瞬夏,shunka25,2013-08-16 10:51:23,0,0
368188471807979521,自分がいつまで栃木に居られるか分からないから、今年のうちに真紅の大優勝旗が栃木に降り立つことを期待…♪#高校野球,343402110,瞬夏,shunka25,2013-08-16 10:52:26,0,0
369272047341289472,昨晩の「情熱大陸」はすごくよかったな。華原朋美。あたしも精一杯今を生きようって思った。,343402110,瞬夏,shunka25,2013-08-19 10:38:11,0,0
369272345111691266,甲子園見ていて、毎年感動するけれど、試合内容以外のことに感動して涙が出そうになるのは年をとったからでしょうか…。#高校野球,343402110,瞬夏,shunka25,2013-08-19 10:39:22,0,0
369272461239402496,弘前聖愛のあの丁寧なお辞儀がとてもいいよね。#高校野球,343402110,瞬夏,shunka25,2013-08-19 10:39:50,0,0
369272747525828608,木更津総合の全力で校歌を歌う姿がいいよね。こんな暑い中試合して、まだそんな元気があるのか！って、すごいパワーをもらう。#高校野球,343402110,瞬夏,shunka25,2013-08-19 10:40:58,0,0
369273043882766336,その木更津総合の校歌斉唱するのに合わせて手拍子する対戦校のアルプス。本当に素敵だと思った。#高校野球,343402110,瞬夏,shunka25,2013-08-19 10:42:09,0,0
369273606397624320,人の心を動かすのは、心臓を鷲掴みにされるのは、ものすごい急速でもものすごい飛距離の打球でもなく、人として大切な誰かを思いやる気持ちや一生懸命さなんだなーと、毎年高校野球から学びます。#高校野球,343402110,瞬夏,shunka25,2013-08-19 10:44:23,1,1
369456434091540480,この一言を言ったら、相手がどんな気持ちになるのか…って思ったら言えないいけど、自分を作ってる思いって案外ある。そう思ってたのが自分だけではなかった、っていうのは、とても力になるもんなんだなー。,343402110,瞬夏,shunka25,2013-08-19 22:50:52,0,0
369465181815861250,そういえば今日、常総学院の試合をテレビで見てて、明治大学の「神風」が流れてきてビックリしたな。っていうか、応援自体が東京六大学メドレー？みたいな曲が多かった。チアもST PAUL？って書いてあったような…#高校野球,343402110,瞬夏,shunka25,2013-08-19 23:25:38,0,0
369469051971461120,よく、いつも名前を聞くような強豪校が負けてしまったあとの甲子園をつまらないと言う人がいる。でも、本当に面白いなと思うのは試合が終わった瞬間に涙を流したり喜んだり、そういう高校生らしさが汗と涙と一緒にこぼれ落ちるところだと思う。#高校野球,343402110,瞬夏,shunka25,2013-08-19 23:41:01,0,0
369600856338874368,これおもしろい。地元の出身校の名前が出るのもいいね。＃高校野球http://www.jiji.com/jc/v?p=kenmin_best9 …,343402110,瞬夏,shunka25,2013-08-20 08:24:45,0,0
369997597240336385,花巻東の千葉くん、誰かにプレースタイルとか風貌とか誰かに似てるなーって調べていたら、09年の花巻東の佐藤涼平くんだ。今どこで何してるんだろうって調べたら亡くなっていただなんて。悲しくて昨晩は寝付けなかったよ。ご冥福をお祈りします。,343402110,瞬夏,shunka25,2013-08-21 10:41:16,0,0
370183345067417601,あらためて、高校野球の注目度を実感してる。花巻東の千葉くん、悔しかっただろうね。こういうニュースが出るたびに、高校野球の閉鎖的な部分が顕著になってる気がする。でも、あれだけできるって、きっと彼はとてつもない努力をしたんだろうね。あたしは好きだな、あーゆー選手。#高校野球,343402110,瞬夏,shunka25,2013-08-21 22:59:21,0,0
370357890952871936,"これ、読んでみて欲しいな。高校野球ファンだけじゃなく、新たな野球の楽しみ方が見つかりそうで、読んでて少しわくわくした。
花巻東、千葉のカット打法の賛否(本郷陽一) - Y!ニュース http://bylines.news.yahoo.co.jp/hongoyoichi/20130822-00027446/ …＃高校野球",343402110,瞬夏,shunka25,2013-08-22 10:32:56,0,0
370387024886243328,結構試合の進みが早いな…。日本で一番長い夏を過ごす2校、幸せだねー！両チームともがんばれー！#高校野球,343402110,瞬夏,shunka25,2013-08-22 12:28:42,0,0
370675293146464256,高校野球も終わってしまい、夏も終わりだなー。しばらくは長島三奈さんと共に甲子園ブルーにひたってしまおう。#高校野球,343402110,瞬夏,shunka25,2013-08-23 07:34:11,0,0
372872835519483904,遅めの夏休み。伊香保へ向かってますが、新前橋で乗り換え。どこを見渡しても前橋育英お祝いムード。,343402110,瞬夏,shunka25,2013-08-29 09:06:26,0,0
374304667984859137,ものすごく疲れて目が覚めた。高校時代付き合ってた人と別れる夢。笑 あー朝からぐったり。,343402110,瞬夏,shunka25,2013-09-02 07:56:01,0,0
375436390575529984,朝あまで涙腺崩壊…(T ^ T)#あまちゃん,343402110,瞬夏,shunka25,2013-09-05 10:53:05,0,0
375635631314972672,人のためにばかり動いていると、自分の人生は自分でしか歩けないってこと忘れがちになってしまう。自分だけは自分で置いてけぼりにしちゃいけないんだね。…と、昨日さだまさしの「主人公」を聞いて思った。,343402110,瞬夏,shunka25,2013-09-06 00:04:48,0,0
377972023625932800,馬場俊英の「弱い虫」のMV見て泣きそうになる9月のある日。,343402110,瞬夏,shunka25,2013-09-12 10:48:47,0,0
380703066275577856,中秋の名月、確かに綺麗だった。次は八年後だって。36歳。笑,343402110,瞬夏,shunka25,2013-09-19 23:40:58,0,0
380703343317753856,確かに綺麗だったけど、毎日空見上げてると特別な美しさではないなって思う。毎日毎日、夕焼けも綺麗なんだ。みんなに見て欲しい。,343402110,瞬夏,shunka25,2013-09-19 23:42:04,0,0
381438634697568257,不思議と話してると元気になれる人っている。何か特別なこと話してるわけでもないのにね。ありがたいことです。,343402110,瞬夏,shunka25,2013-09-22 00:23:51,0,0
383214551002402816,相撲の遠藤、ロバート秋山に似てるとか言われてるけど、あたしには巨人の村田に見える…。,343402110,瞬夏,shunka25,2013-09-26 22:00:43,0,0
