tweet_id,tweet,user_id,user_name,user_screen_name,timestamp,retweets,favourites
169445791730114560,【接続テスト】ブクログからの投稿テストだよ http://booklog.jp ,108912930,コータ,kota_sugi,2012-02-15 00:39:59,0,0
169449831956357120,黒木さんが痛々しすぎて見てられません。だがそこも含めて面白いと思ってしまう自分がいる訳で。黒木さんに弟が...『私がモテないのはどう考えてもお前らが悪い!(...』谷川 ニコ ☆4 http://bit.ly/z7f6OG  #booklog,108912930,コータ,kota_sugi,2012-02-15 00:56:02,0,0
169843426223865856,"面白い。
御子柴さんのキャラが良いです。
それぞれの話がすっきり終わってくれるので、気持ちよく読み進めら...『図書館の主 1 (芳文社コミックス)』篠原 ウミハル ☆4 http://bit.ly/wOm6kS  #booklog",108912930,コータ,kota_sugi,2012-02-16 03:00:03,0,0
171937107873501184,"ずーっと気にはなっていたのだけれど、読んでみたら期待通りの面白さ。
古屋兎丸だから絵柄で好き嫌いがある...『帝一の國 1 (ジャンプコミックス)』古屋 兎丸 ☆5 http://bit.ly/yPcM0r  #booklog",108912930,コータ,kota_sugi,2012-02-21 21:39:35,0,0
171939081893314565,"ギャグ色強め。
もう、光明がツボすぎる。おまえって奴は。

ホント、なんでこれがマンガ大賞にノミネ...『帝一の國 2 (ジャンプコミックス)』古屋 兎丸 ☆5 http://bit.ly/znxp4h  #booklog",108912930,コータ,kota_sugi,2012-02-21 21:47:26,0,0
172350128601042945,この時間の孤独のグルメは拷問だね。,108912930,コータ,kota_sugi,2012-02-23 01:00:47,0,0
172350808518705152,こんな一人焼き肉の店なんて絶対に入れないんだろうなぁ。,108912930,コータ,kota_sugi,2012-02-23 01:03:29,0,0
182506012077588480,孤独のグルメが終わってしまった。水曜日はこれを楽しみにしてたんだけどなぁ…シーズン２を期待するしかない。#tx_kodokugurume,108912930,コータ,kota_sugi,2012-03-22 01:36:38,0,0
188262791277318144,紅豚。どれだけ見ても、飽きずに観られるって本当に凄いと思う。いい話だ。,108912930,コータ,kota_sugi,2012-04-06 22:52:01,0,0
188263174179528705,またコナンか。ルパンかコナンかって感じだな。,108912930,コータ,kota_sugi,2012-04-06 22:53:33,0,0
193012988087762944,チキンタツタは復活し過ぎで、なんの新鮮味も有り難みもない。,108912930,コータ,kota_sugi,2012-04-20 01:27:37,0,0
200216504061538305,釣りバカがやってるが全然釣りしてないし(笑),108912930,コータ,kota_sugi,2012-05-09 22:31:49,0,0
200217988606083072,檀れいさんはやっぱり金麦だな。,108912930,コータ,kota_sugi,2012-05-09 22:37:43,0,0
200219211774181377,でもなんだかんだで、みんなピカルを観てるんだろ。,108912930,コータ,kota_sugi,2012-05-09 22:42:34,0,0
200946328111546368,ナウシカやってんじゃん!!,108912930,コータ,kota_sugi,2012-05-11 22:51:52,0,0
200950315464396800,今だったら、王蟲はCGになっちゃうんだろうなぁ。,108912930,コータ,kota_sugi,2012-05-11 23:07:43,0,0
200951549214724096,この腐りっぷりがハンパない(笑),108912930,コータ,kota_sugi,2012-05-11 23:12:37,0,0
214787943183810560,明日、朝から歯医者なのに全然眠れない(T-T),108912930,コータ,kota_sugi,2012-06-19 03:33:30,0,0
215260686316605440,"あ、あつい｡｡。
まさに台風一過ってやつだな。",108912930,コータ,kota_sugi,2012-06-20 10:52:01,0,0
215265782727323649,洗濯物を干さねば！,108912930,コータ,kota_sugi,2012-06-20 11:12:16,0,0
216396771985850368,ポケモン好きならぜひ観てほしい。　【物理編】ポケ×ポケ～世界で誰も見たことがない対決SHOW～ (18:13) #sm18168247 http://nico.ms/sm18168247 ,108912930,コータ,kota_sugi,2012-06-23 14:06:25,0,0
221330422179696641,"目が覚めてしまった。
もうちょっと寝てたかったんだけどどうすっかなー。",108912930,コータ,kota_sugi,2012-07-07 04:50:59,0,0
224169624084815872,メロエッタのことをアリエッティって言ってしまう。しかも一度や二度ではない。,108912930,コータ,kota_sugi,2012-07-15 00:52:57,0,0
224171737816907777,特性は借りぐらしで、相手ポケモンの道具の効果を自分にも付けるみたいな感じだな。,108912930,コータ,kota_sugi,2012-07-15 01:01:21,0,0
224172341733769216,それにしても寝苦しい夜だ…,108912930,コータ,kota_sugi,2012-07-15 01:03:45,0,0
231784024245403649,ファミマで思わず買ってしまった。http://p.twipple.jp/Z1TfE ,108912930,コータ,kota_sugi,2012-08-05 01:09:52,0,0
236495864867205121,トイレの水が止まらなくなった(;_;),108912930,コータ,kota_sugi,2012-08-18 01:13:02,0,0
236496514204184576,取り敢えず元栓閉めて、次からはバケツで流すしかないか…,108912930,コータ,kota_sugi,2012-08-18 01:15:37,0,0
236497559294734338,タンクを開けてみたら、汚れだかカビだかでとても汚い。洗おう。,108912930,コータ,kota_sugi,2012-08-18 01:19:46,0,0
236512238729568256,なんかパイプ状の部品が折れてたから、色々調べてみると、どうやらオーバーフロー管という部品が根元からポッキリ逝ってしまったようだ。,108912930,コータ,kota_sugi,2012-08-18 02:18:06,0,0
236513020874997761,INAXのトイレはこんな事態に陥る人が多いみたいだ。困ったもんだ。,108912930,コータ,kota_sugi,2012-08-18 02:21:13,0,0
236514545621925888,塩ビのパイプなんかで案外簡単に直せそうなので、明日ホームセンターで買ってこよう。,108912930,コータ,kota_sugi,2012-08-18 02:27:16,0,0
236849225147744257,トイレだけど、あっという間に直った。これが修理を頼むと1万円位かかるというのが驚きだ。ぼったくりか。,108912930,コータ,kota_sugi,2012-08-19 00:37:10,0,0
239792042304221184,明日、明後日が今年の夏休み。5ヵ月振りの連休です。楽しみます！,108912930,コータ,kota_sugi,2012-08-27 03:30:52,0,0
239792307354873856,あ、もう今日か。,108912930,コータ,kota_sugi,2012-08-27 03:31:55,0,0
254263351021039616,@EBIbody フォローありがとうございます(｀・ω・´)よろしくデス,108912930,コータ,kota_sugi,2012-10-06 01:54:41,0,0
254265855184080896,スタイリッシュだなー。 #Ｋ,108912930,コータ,kota_sugi,2012-10-06 02:04:38,0,0
254266933648699393,やたらと声優豪華だな #Ｋ,108912930,コータ,kota_sugi,2012-10-06 02:08:55,0,0
254267287606030336,で、これはなにアニメ？ #Ｋ,108912930,コータ,kota_sugi,2012-10-06 02:10:20,0,0
254268871115153408,いやー渋谷はモブが多くて大変だねぇ。 #Ｋ,108912930,コータ,kota_sugi,2012-10-06 02:16:37,0,0
254269477154324480,赤くなってんじゃねぇよ(笑) #Ｋ,108912930,コータ,kota_sugi,2012-10-06 02:19:02,0,0
254270250252652545,あー終わった。 #Ｋ,108912930,コータ,kota_sugi,2012-10-06 02:22:06,0,0
254271662873251840,次はテンペストなんだね。,108912930,コータ,kota_sugi,2012-10-06 02:27:43,0,0
254273531209203712,そういえばジャンプって今日発売か？,108912930,コータ,kota_sugi,2012-10-06 02:35:08,0,0
254277211014701056,最近、ハイキューをちゃんと読み直してるんだけど、やっぱりコミック買わなきゃダメだ。,108912930,コータ,kota_sugi,2012-10-06 02:49:46,0,0
254278766833061888,そーなってくるとニセコイも買ってしまいたいのだが、それはどうなんだろうか。,108912930,コータ,kota_sugi,2012-10-06 02:55:56,0,0
254288516975046656,もういい加減に寝ないと。5時半起きなんだが大丈夫だろうか…,108912930,コータ,kota_sugi,2012-10-06 03:34:41,0,0
254448495455502336,さ、最悪だ…車にキズが…,108912930,コータ,kota_sugi,2012-10-06 14:10:23,0,0
256057044308742145,いやー、やっぱり孤独のグルメたまらないよ,108912930,コータ,kota_sugi,2012-10-11 00:42:11,0,0
297391694754750464,NHK超面白い。コラボもここまで本気でやると凄いモノが創れるんだね。,108912930,コータ,kota_sugi,2013-02-02 02:11:19,0,0
297393629658488832,この番組、第2夜は日テレで放送するの？凄いな。,108912930,コータ,kota_sugi,2013-02-02 02:19:01,0,0
297467225806352384,"気付けばもう20巻。
新キャラ上代祥真との出会いで、三橋がまた一つ成長した感じ。
甲子園での再会が待ち遠...『おおきく振りかぶって(20) (アフタヌーンKC)』ひぐち アサ ☆4 http://bit.ly/XugZaq  #booklog",108912930,コータ,kota_sugi,2013-02-02 07:11:27,0,0
300265618324746243,"今日は肉の日だったので牛角ってきた。
みんな同じ考えだったようで、凄い混みっぷりでしたよ。",108912930,コータ,kota_sugi,2013-02-10 00:31:16,0,0
413313470747013123,次のドラマは観ないだろうなぁ。,108912930,コータ,kota_sugi,2013-12-18 23:23:05,0,0
413315884329865217,ありゃ、猪瀬さん辞任か。,108912930,コータ,kota_sugi,2013-12-18 23:32:40,0,0
413654092267798529,新しい加湿器がとても静かに潤してくれる。,108912930,コータ,kota_sugi,2013-12-19 21:56:35,0,0
413656099665899520,西川きよし、まさかの王将ネタか。偶然だけど凄いな。,108912930,コータ,kota_sugi,2013-12-19 22:04:34,0,0
414474024186437632,変な時間に起きてしまった。今から寝るのも微妙だなぁ。,108912930,コータ,kota_sugi,2013-12-22 04:14:42,0,0
415123251568713728,あー、桐谷さんで爆笑しすぎた。,108912930,コータ,kota_sugi,2013-12-23 23:14:30,0,0
416563628716724224,ナウシカは美人さんだなぁ。,108912930,コータ,kota_sugi,2013-12-27 22:38:03,0,0
417579504387649536,@ishikawamasayuk とても大好きな漫画で毎回コミックスが出るのを楽しみにしてました。連載終了は残念ですが…、本当にお疲れ様でした！,108912930,コータ,kota_sugi,2013-12-30 17:54:46,0,0
417855607245656064,BSで孤独のグルメ一挙放送してる！6時間！,108912930,コータ,kota_sugi,2013-12-31 12:11:54,0,0
418273915715063808,あけましておめでとうございます。今年も宜しくお願い致します。家は明日、初詣に行きます。,108912930,コータ,kota_sugi,2014-01-01 15:54:07,0,0
419006428779540481,録画してあった、眠りの森観終わった。面白かったけど、とても切ないお話でした。冒頭の仲間由紀恵さんには驚き。しかも、山田さんって(笑),108912930,コータ,kota_sugi,2014-01-03 16:24:52,0,0
420945462707769344,コララインとボタンの魔女を観た。これが全てストップモーションアニメとは・・・驚愕です。,108912930,コータ,kota_sugi,2014-01-09 00:49:53,1,0
422370420893822976,ヘイポー面白すぎる。,108912930,コータ,kota_sugi,2014-01-12 23:12:10,0,0
422371711627960320,内野！！言いすぎ。,108912930,コータ,kota_sugi,2014-01-12 23:17:18,0,0
422373254146179072,軽メシwww,108912930,コータ,kota_sugi,2014-01-12 23:23:25,0,0
423113605207162880,千葉雄大は女子だなぁwww,108912930,コータ,kota_sugi,2014-01-15 00:25:19,0,0
423114125745463296,でも、やっぱりゴセイジャーのイメージが強いかな。,108912930,コータ,kota_sugi,2014-01-15 00:27:23,0,0
424500756637425664,メンディーwww,108912930,コータ,kota_sugi,2014-01-18 20:17:21,0,0
424874835500490752,イッテＱイモト面白かったwww,108912930,コータ,kota_sugi,2014-01-19 21:03:49,0,0
425639803544027137,外は寒すぎる・・・,108912930,コータ,kota_sugi,2014-01-21 23:43:31,0,0
427819898824183808,永井さんが・・・悲しい。,108912930,コータ,kota_sugi,2014-01-28 00:06:27,0,0
428886553482383360,個人的には最後までブレずに作っていって欲しいんだけどなぁ・・・,108912930,コータ,kota_sugi,2014-01-30 22:44:57,0,0
432399850483638273,TSUTAYAのレジがあり得ないほど混んでいる・・・,108912930,コータ,kota_sugi,2014-02-09 15:25:32,0,0
