tweet_id,tweet,user_id,user_name,user_screen_name,timestamp,retweets,favourites
21077760248127488,極度の末端冷え性で、今の季節はもこもこ着ぶくれしています。冷え性に効果があると言われる物を色々試していますが、なかなか改善されません。現在ベビ活中なので、冷えの改善＆妊娠ができたら、本当に嬉しいです。 http://bit.ly/es4QZQ,124464059,まにたん,mani_tan,2011-01-01 14:38:24,0,0
21078792185315328,旅行に行った際、ANA機内誌「翼の王国」にアンティアンさんの石鹸が紹介されているのを拝見しました。以前にも増して、使用感を自分の肌で確かめてみたいという気持ちが強まりました。香りにも期待しています。 http://bit.ly/eP9aSn,124464059,まにたん,mani_tan,2011-01-01 14:42:30,0,0
21080530439114754,寒い季節のファッションに欠かせないタイツ。私も愛用しています。足元の印象でコーデの印象もがらっと変わるので、着こなしの幅が広がりそう！デザインはもちろん、履き心地の良さも是非自分で確かめてみたいです。 http://bit.ly/gXusVi,124464059,まにたん,mani_tan,2011-01-01 14:49:24,0,0
21120559521726464,「今年の目標をtweet＆福袋GET!」http://bit.ly/e60M5J #wacoal_akeome 英語力のアップ！,124464059,まにたん,mani_tan,2011-01-01 17:28:28,0,0
21125938653691904,緊張してテンぱった。@mani_tanさんのタイピングは1光年レベルです。ファミマ30周年記念タイピングゲームなう。今日の日替わり豪華景品は「ファミマ専用プリカ3000円」！ http://famima30.jp #famima30,124464059,まにたん,mani_tan,2011-01-01 17:49:50,0,0
21896867633700864,旅行で長野に行くと必ず食べるのが、おやき。旅先でしか食べられないものだと思っていたのですが、こうやってお取り寄せできると大変有り難いです。おやきを知らない友達にも、是非紹介したいです。 http://bit.ly/foCUCS,124464059,まにたん,mani_tan,2011-01-03 20:53:14,0,0
21898305344634880,R.Lのワッフル1月おすすめの1味は。。。 @RL_WaffleCake #rlwaffle_cp1101 http://bit.ly/eubKbN黒みつきな粉！和スイーツと洋スイーツの融合ですね。他にはなさそうなのも魅力です。,124464059,まにたん,mani_tan,2011-01-03 20:58:57,0,0
22206261869154304,以前「穂のしずく」飲ませていただいたのですが、ちょっとしたイライラにも効果があるんですね！日常的にカチンとくることや小さなイライラがあるので、ストレスを溜めないためにも植物サプリの力を借りたいです。 http://bit.ly/hI00wW,124464059,まにたん,mani_tan,2011-01-04 17:22:40,0,0
22527073125933056,愛用していたバッグのファスナーが、手袋のファーを噛んでしまい使えなくなってしまいました。日常にお出掛けに、これからもずっと愛用できるバッグを探しています。是非、使い心地を多くの方に伝えたいです。 http://bit.ly/fnRWsC,124464059,まにたん,mani_tan,2011-01-05 14:37:27,0,0
22954584628531200,2011年は素材にこだわったお料理をしたいです！クスマイのBIOで、いつもとは違う風味のパスタを味わいたいです。友人が健康のため、天ぷらにオリーブオイルを使っていると聞いたので、真似してみたいです。 http://bit.ly/gSqPIt,124464059,まにたん,mani_tan,2011-01-06 18:56:14,0,0
23712908965847040,炭水化物も甘い物も大好きです。今までダイエットをしてきませんでしたが、年齢とともに代謝が落ちてきたのか、年末年始の暴飲暴食が原因なのか、太ってきました。手が打てるうちに、早めに体重を戻したいです。 http://bit.ly/hgEuwO,124464059,まにたん,mani_tan,2011-01-08 21:09:32,0,0
23713909202493441,美瑛といえば美瑛の丘！美しい風景が大好きです。　 JAびえい「美瑛選果」 @bieisenka #bieisenka-tw http://bit.ly/g7qFlJ,124464059,まにたん,mani_tan,2011-01-08 21:13:31,0,0
23715017987719168,生理前に必ずできる顎のニキビ。自分が一番気にしているのに、できるたびに職場の人たちにも指摘されるので、仕事に行くのが嫌になってしまうほどです。ずっと悩みのタネのニキビ。早くさよならしたいです。 http://bit.ly/hnVFuq,124464059,まにたん,mani_tan,2011-01-08 21:17:55,0,0
23715967171297280,今までダイエットをしたことがなかったのですが、年末年始の食べ過ぎ＆ゴロゴロ生活で太ってしまいました。年のせいか、代謝も落ちてきたようです。体重を戻せるうちに早く戻したいので、是非使ってみたいです。 http://bit.ly/e0qxMv,124464059,まにたん,mani_tan,2011-01-08 21:21:41,0,0
23716665489358848,洗剤によっては、肌にかゆみを感じる場合があります。CMでお肌に優しいという洗剤を使用しましたが、調べてみたら漂白剤・蛍光剤が入っていないだけで、他の洗剤とすっかり同じ成分でがっかりしたことがあります。 http://bit.ly/eBRbR2,124464059,まにたん,mani_tan,2011-01-08 21:24:28,0,0
23718132371689472,ダイエットをしたことがなかったのですが、年齢とともに代謝が落ちてきたようで、太ってきました。元々疲れやすく、肌の調子もあまり良くないので、色々な効果が期待できるサプリの効果を是非実感してみたいです。 http://bit.ly/frWkgZ,124464059,まにたん,mani_tan,2011-01-08 21:30:18,0,0
23724651486126081,自分たちの生活にも関わってくる、難しい問題だと思います。他の方がどう考えているかも、是非知りたいところです。時代背景を踏まえて、少しでも国政が良い方向に進んでくれれば、と願うばかりです。 http://bit.ly/dZJprg,124464059,まにたん,mani_tan,2011-01-08 21:56:12,0,0
23725469748695040,毎日シャンプーしているのに、頭皮にフケのようなものが出る時があります。見つけるたびに、なぜ･･･とブルーになります。地肌の乾燥が原因なのでしょうか？是非自分で使用してみて、製品の効果を実感したいです。 http://bit.ly/ickCmE,124464059,まにたん,mani_tan,2011-01-08 21:59:27,0,0
25042507825938433,オールインワンって大丈夫？と思っていたので、あまり使ったことがありません。でも、全身のケアに使えるのは魅力的。真冬でも潤ってくれそうです。是非自分の肌で使用感を確かめ、多くの人にお伝えしたいです。 http://bit.ly/gmYelb,124464059,まにたん,mani_tan,2011-01-12 13:12:53,0,0
25537179321114625,【ちらし寿司☆】←ひなまつりに食べたいものをつぶやいてください！みゆき堂本舗 @miyukidou #senbeihina http://bit.ly/fr3rWK,124464059,まにたん,mani_tan,2011-01-13 21:58:32,0,0
25538165196464128,お料理にもっとベーコンを使いたいのですが、添加物や味が心配で、機会が少ないままでした。紹介を拝見し、これなら安心して食べられそうと思っています。肉の旨味を引き出すような、お料理に使いたいです。 http://bit.ly/eZDlg6,124464059,まにたん,mani_tan,2011-01-13 22:02:27,0,0
25539160286695424,オイルで美味しく美しくなれるなんて、とっても素敵。風味を確かめながら、色々なお料理に使ってみたいです。 http://bit.ly/eWjBis,124464059,まにたん,mani_tan,2011-01-13 22:06:24,0,0
26084829669892096,お洋服!?と思わせてくれるエプロン、とってもカワイイです！毎日のお料理が楽しくなりそう。町内会行事（お祭り準備など）でエプロン持参の機会が多いので、是非ご近所ママさんたちにも広めたいです。 http://bit.ly/dOUTjn,124464059,まにたん,mani_tan,2011-01-15 10:14:42,0,0
26296341705523200,【レッツビューティ】 http://bit.ly/iiLnlf 高級ホテルの中のサロンで、いい香りに包まれてゆっくりとサービスうけたいなぁ〜。#letsbtytwcp1,124464059,まにたん,mani_tan,2011-01-16 00:15:11,0,0
26298475532517376,#ddsainan仕事中に車のエンジンが止まり、先輩と一緒に車を押しました・・・。疲れた。,124464059,まにたん,mani_tan,2011-01-16 00:23:39,0,0
26299229005684736,#daisuki 大好きのきもちをここへ→さりげない優しさにいつも感謝しています。これからも、ずっとよろしくね☆,124464059,まにたん,mani_tan,2011-01-16 00:26:39,0,0
27270726331404288,ファンデを塗る時に、パフばかりを使っています。ブラシだからできる仕上がりや使い方をマスターして、もっとメイクを楽しみたいです。同じように思っているより多くの人に、製品の良さを伝えていきたいです。 http://bit.ly/gwb0hL,124464059,まにたん,mani_tan,2011-01-18 16:47:02,0,0
27271904574312448,バレンタインに、夫にプレゼントしたいです。日頃から皮製品やビジネスグッズにこだわりを持っている夫。製品の素晴らしさは使ってもらえば、必ず分かると思います。是非ブログでレポートしたいです。 http://bit.ly/fv5ngh,124464059,まにたん,mani_tan,2011-01-18 16:51:43,0,0
27273515057025024,「冷え」が悩みの私。手足は氷のようで、いつも着ぶくれしています。冷えに効果があると聞くと色々なものを試していますが、なかなか改善されません。体の中から冷えを撃退してくれる製品、効果を実感したいです。 http://bit.ly/hWGYJp,124464059,まにたん,mani_tan,2011-01-18 16:58:07,0,0
27274316945031169,ノンシリコンシャンプーを使ったことがあるのですが、髪がまとまりにくくなりました。こちらは髪にも環境にも優しいということで、とても期待しています。是非その効果を、自分の髪で実感したいです。 http://bit.ly/dZNb3U,124464059,まにたん,mani_tan,2011-01-18 17:01:18,0,0
27577165134438400,他社さんの炭酸パックを使用したことがあります。炭酸パックの効果には驚きだったので、こちらの商品の効果にも非常に興味があります。その場しのぎではなく、将来のお肌のことを考えたケアをしていきたいです。 http://bit.ly/hsjNOg,124464059,まにたん,mani_tan,2011-01-19 13:04:43,0,0
28089962041704451,職場でも、食事の後は必ず歯を磨いています。旅行に行くことも多いので、ポーチの中からサッと取り出して、磨きたいです。見た目だけでなく、機能も優秀な歯ブラシ。常に持ち歩いて、友達や同僚にも紹介したいです。 http://bit.ly/fMX09q,124464059,まにたん,mani_tan,2011-01-20 23:02:23,0,0
28345750672900096,毎日酷使している手。なかなか手荒れが改善しません。車を運転する機会が多いので、右側の手にだけシミやホクロが多いのも気になっています。手指を乾燥、紫外線から守ってくれる製品、是非効果を確かめたいです。 http://bit.ly/hWJzOj,124464059,まにたん,mani_tan,2011-01-21 15:58:48,0,0
28817948588122112,今まで色々なコラーゲンを飲んできましたが、コンドロイチンが含まれたものは初めてです。加齢と共に失われていく成分を美容だけではなく、健康維持のためにも役立てたいです。是非その効果や変化を実感したいです。 http://bit.ly/h4uIiR,124464059,まにたん,mani_tan,2011-01-22 23:15:09,0,0
28819512702799872,お正月太りが抜けないまま、月を越えそうです。ダイエットはもちろん、美容・健康に良い成分がバランス良く配合されたサプリで、内側からキレイになりたい！周りから「どうやって痩せたの？」と聞かれてみたいです。 http://bit.ly/hlqbWC,124464059,まにたん,mani_tan,2011-01-22 23:21:21,0,0
28821311681724419,コスメ大好きなので、今使っている棚に入りきらないグッズがたくさん溢れています。コンパクトなのに沢山収納できるコスメケースで、私の大量のコスメを整理したいです。かわいいデザインにも注目しています。 http://bit.ly/f31B1k,124464059,まにたん,mani_tan,2011-01-22 23:28:30,0,0
28822005683855360,【mimoi×つぶやきキャンペーン】私の今年の美容の抱負は【シミをなくす！作らない！】です♪ @mimoi_bf #mimoi_twcp04 http://bit.ly/fMqdmw,124464059,まにたん,mani_tan,2011-01-22 23:31:16,0,0
28823613691920385,チョコレート大好き！でも、食べるとニキビが･･･。紹介文を読んで、これなら私でもニキビに心配をせずに食べられるのでは？と期待大です。美味しくて体にも良いチョコレート、是非チョコ好き夫と味わいたいです。 http://bit.ly/dF5xY9,124464059,まにたん,mani_tan,2011-01-22 23:37:39,0,0
29023493278400512,毎日必ず使うあぶらとり紙で、小顔になれるなんて夢のよう！他の製品にはない、トルマリン効果でどれだけ小顔・美肌になれるのか、期待しています。是非自分の肌で、その効果を実感したいです。 http://bit.ly/hnUoWG,124464059,まにたん,mani_tan,2011-01-23 12:51:54,0,0
29403834539319296,今までにないタイプのお茶漬け、とても興味があります。合わせるおにぎりの具によって、色々な組み合わせが楽しめそうで、期待しています。昼食でコンビニおにぎりを買うことが多いので、是非味わってみたいです。 http://bit.ly/e0eCgB,124464059,まにたん,mani_tan,2011-01-24 14:03:15,0,0
29404247527264256,【　苺＆苺を使ったスイーツ♪　】←春になると食べたくなるものをつぶやいてください！みゆき堂本舗 @miyukidou #miyuki_haru http://bit.ly/gOQphI,124464059,まにたん,mani_tan,2011-01-24 14:04:53,0,0
29518362497257474,使用する人の声を反映させて作られた製品ということに、大変興味を持ちました。と同時に含まれているヒアルロン酸が、内側から肌を押し上げてくれそうだと期待しています。是非自分の肌でその効果を実感したいです。 http://bit.ly/exGe31,124464059,まにたん,mani_tan,2011-01-24 21:38:20,0,0
29519572126146560,アロマの香りが大好きです。自然の植物の力で、毎日リラックス＆リフレッシュしながらスキンケアができるのは理想的。お家エステのようで贅沢ですね。是非その使用感を確かめ、より多くの人に魅力を伝えたいです。 http://bit.ly/dLqMvd,124464059,まにたん,mani_tan,2011-01-24 21:43:09,0,0
29521110647185408,乾燥して手荒れがひどかったり、仕事（介護・訪問入浴）の機材で手を切ってしまったりと、絆創膏は毎日のように使っています。是非、使い心地を自分で試し、より多くの方にその使用感を広めたいです。 http://bit.ly/gXmCxH,124464059,まにたん,mani_tan,2011-01-24 21:49:15,0,0
29524211529678849,仕事柄手荒れがひどく、手荒れにハンドケアが追いつかない状態です。べたつきが苦手なので、自分に合ったハンドクリームに出会えていません。手指に優しく、効果の高いハンドクリームの効果、是非実感したいです。 http://bit.ly/hgv15A,124464059,まにたん,mani_tan,2011-01-24 22:01:35,0,0
29525446823510016,私が紅茶・お茶を飲む時に一番心配しているのが農薬なのですが、こちらはオーガニックで原料の段階から安全性が高いので、安心して飲むことができそうです。フレーバーと共に、原料本来の美味しさを楽しみたいです。 http://bit.ly/eYtkor,124464059,まにたん,mani_tan,2011-01-24 22:06:29,0,0
29750418288418816,日頃から日本ゼトックさん製造の歯磨き粉を愛用していますが、緑茶成分の入った製品は知りませんでした。口臭予防にも役立つ製品、接客業をしている私にとって心強いです。是非、その効果と味？を体験したいです。 http://bit.ly/gnZqKu,124464059,まにたん,mani_tan,2011-01-25 13:00:27,0,0
29751431544180736,冷え性なので、生姜の商品を探しています。ティーバックになっているので、時間のない朝にも手軽に飲めそう。お茶の風味も楽しみです。是非その味わいを、自分で確かめたいです。 http://bit.ly/hjsmXa,124464059,まにたん,mani_tan,2011-01-25 13:04:28,0,0
29752320409477120,植物の恵みを存分に使った歯磨き粉、初めて耳にしました。今までにない製品だと思います。是非その使用感や効果を自分で確かめ、より多くの方に広めたいです。 http://bit.ly/g6Kuby,124464059,まにたん,mani_tan,2011-01-25 13:08:00,0,0
29905343718891520,#ULTIRA_WMC 映画館だからこそ観られる映像を、より楽しめそう！期待大です。,124464059,まにたん,mani_tan,2011-01-25 23:16:04,0,0
29905626003935232,#DBOX_WMC アクション・SF映画をこちらで是非観てみたいです！,124464059,まにたん,mani_tan,2011-01-25 23:17:11,0,0
30090246871851009,お肌と体に良い様々な成分と、美味しい風味で、体の内側からキレイになりたいです。是非、その効果を実感したいです。続けて飲んだ効果や体調の変化を定期的にブログにアップし、分かりやすく伝えたいです。 http://bit.ly/fLAhai,124464059,まにたん,mani_tan,2011-01-26 11:30:48,0,0
30092662161801216,今使っている綿のボディタオルは泡立ちが悪く、ゴワゴワ。手足の乾燥がひどくなるにつれ、ボディタオルが使えない部位が増えました。優しい柔らかさでしっかりと洗える製品を使い、肌と今の洗い方を改善したいです。 http://bit.ly/ifAn4H,124464059,まにたん,mani_tan,2011-01-26 11:40:24,0,0
30258728582254593,寒さで血色が悪くなってしまうので、今時期は特にチークが必需品です。これまでピンク系のチークばかり使ってきたので、是非違う色で新しい自分をプロデュースしたいです。 http://bit.ly/fpb9xT,124464059,まにたん,mani_tan,2011-01-26 22:40:17,0,0
30605751558864896,花粉の時期になると薬を飲まずにはいられない位辛いのですが、服用すると眠くなってしまうので困ります。できるだけ体に負担のかからない方法で、花粉症の症状を和らげたいです。商品の効果を是非実感したいです。 http://bit.ly/hZcBvt,124464059,まにたん,mani_tan,2011-01-27 21:39:14,0,0
30979342452391936,【アイダホなう！早く食べたい！】アイダホバーガーを食べてつぶやこう！抽選でマックカードプレゼント！ http://w.mdj.jp/hhj #McD_beef #McD_idaho,124464059,まにたん,mani_tan,2011-01-28 22:23:45,0,0
31171074913730561,とっても美味しそうな苺大福、是非食べてみたいです。友達が家に遊びに来る機会が多いので、その時に一緒に食べて感想を聞きたいです。 http://bit.ly/elEPiR,124464059,まにたん,mani_tan,2011-01-29 11:05:38,0,0
31173534097084416,顆粒だしを使っていますが、色々な添加物が心配です。本当はきちんと鰹節、にぼしなどからだしを取ればいいのですが、面倒でしていません。私の希望を叶えてくれそうなだしパック、使い勝手も風味も楽しみです。 http://bit.ly/ho4GR0,124464059,まにたん,mani_tan,2011-01-29 11:15:24,0,0
31174343392231424,正月太りが解消されないまま現在に至り、危機感を感じています。自分であれこれチャレンジしていますが、なかなか成果が出ません。冬なので甘いものも止められません。是非自分で使用し、その効果を実感したいです。 http://bit.ly/g8EbYs,124464059,まにたん,mani_tan,2011-01-29 11:18:37,0,0
31174840069132288,【寒い冬には煮込みうどん！味がしみてて美味しい♪】 @harima_seimen #resipe_event http://bit.ly/gZeNuU,124464059,まにたん,mani_tan,2011-01-29 11:20:35,0,0
31175654200315904,香りや風味が楽しめるだけでなく、美肌効果も期待できるのは理想的です。バラの香りが漂う、上品な女性を目指したいです。飲むとどんな効果があるか、是非自分で体験してみたいです。 http://bit.ly/eZDfQ8,124464059,まにたん,mani_tan,2011-01-29 11:23:49,0,0
31352757852045312,ダイエットは栄養バランスが偏りがちになるイメージが強いのに、美肌効果も期待できるのは理想的です。ダイエットをしながら美肌に必要なビタミンや栄養素を摂り、キレイになりたい！是非効果を実感したいです。 http://bit.ly/hj1TqJ,124464059,まにたん,mani_tan,2011-01-29 23:07:34,0,0
31913992867811328,R.Lのワッフル2月おすすめの1味は全部美味しそうだけど、「アップルシナモンレーズン」！ @RL_WaffleCake #rlwaffle_cp1102 http://bit.ly/ihPoBp,124464059,まにたん,mani_tan,2011-01-31 12:17:43,0,0
32321039945961472,チョコレートもワッフルも大好きなので、両方がいっぺんに食べられるなんてシアワセ！是非味わって、多くの人に美味しさを伝えたいです。友達が遊びにくることが多いので、お取り寄せ好きな友達にも紹介したいです。 http://bit.ly/ghetFp,124464059,まにたん,mani_tan,2011-02-01 15:15:11,0,0
32328526954766336,春にもぴったりなかわいらしいデザインですね。履き心地、歩き心地も計算されているので、旅行にも是非履いていきたいです。色々なファッションに合わせて、靴をおしゃれの中心にしたいです。 http://bit.ly/fgqjPz,124464059,まにたん,mani_tan,2011-02-01 15:44:56,0,0
38395532279816192,なんとかして、アルガード #kafunsos今年の花粉は6倍って・・・どうしたらいいの～？？,124464059,まにたん,mani_tan,2011-02-18 09:33:02,0,0
39566769332948992,"≪LIKE！出展記念≫『香味庵手焼えびせんべいお試しセット』をもらおう♪次のURLから、無料会員登録＆このイベント情報を紹介するだけ♪
 http://like.jp/e/158/32127 #like_jp",124464059,まにたん,mani_tan,2011-02-21 15:07:07,0,0
39567388441579520,≪大好評につき追加≫@like_jpをフォローして『ちょこっとオアシス（小型携帯加湿器）』をもらおう♪ 次のURLから無料会員登録＆クチコミするだけの簡単応募☆コンパクトでどこでも一緒に出掛けられそう！ http://like.jp/e/285/32127 #like_jp,124464059,まにたん,mani_tan,2011-02-21 15:09:35,0,0
39567999803326464,≪LIKE！出展記念≫母子手帳ケースにも使える『ぬいぐるみ貴重品ケース』をプレゼント♪次のURLから、無料会員登録＆このイベントを紹介するだけ♪リラックマ大好き！カワイイので是非使ってみたいです。 http://like.jp/e/193/32127 #like_jp,124464059,まにたん,mani_tan,2011-02-21 15:12:00,0,0
39568616735117312,≪新規ユーザー様限定≫『ミンティア』ワイルド＆クール味30個を1名様にどどんとプレゼント♪次のリンクから無料会員登録＆応募するだけ☆気分転換に食べています。友達や同僚で分けて、みんなでスッキリしたいな☆ http://like.jp/e/254/32127 #like_jp,124464059,まにたん,mani_tan,2011-02-21 15:14:28,0,0
39569441440145408,"★☆自家牧場の牛乳とさくら卵を使った、ミルクいっぱいのおいしいプリンを限定１名様にプレゼント☆★次のURLから、無料会員登録＆このイベント情報を紹介するだけ♪友達と一緒に味わいたいです。

 http://like.jp/e/217/32127 #like_jp",124464059,まにたん,mani_tan,2011-02-21 15:17:44,0,0
39570625710264320,"TOYOTA　QB36のミシンで作りたい物は何ですか？
洋服、小物類。子供の保育園・幼稚園グッズのためにも、是非一台欲しいです。 http://like.jp/e/181/32127 #like_jp",124464059,まにたん,mani_tan,2011-02-21 15:22:27,0,0
39571116578050048,"RT 『LIKE！』QUOカード3,000円分をプレゼント♪次のＵＲＬからカンタン会員登録＆応援ツイートするだけ♪
色々な商品に興味がある人にピッタリ！とっても楽しいサイトですよ。 http://like.jp/e/234/32127 #like_jp",124464059,まにたん,mani_tan,2011-02-21 15:24:24,0,0
39571583802540032,"是非英語を身につけたい人に！RT ≪大注目≫12日の簡単トレーニングで英語耳になる『マジックリスニング』を紹介して、 『マジックリスニング』を体験しよう♪次のリンクから無料会員登録＆応募するだけ☆
 http://like.jp/e/152/32127 #like_jp",124464059,まにたん,mani_tan,2011-02-21 15:26:15,0,0
39978223211257856,女性に嬉しい食事とは、【栄養バランスが良く、見た目も味も満足で低カロリーなメニューです☆】 @862101 #nichirei http://bit.ly/hOCOOH,124464059,まにたん,mani_tan,2011-02-22 18:22:05,0,0
