tweet_id,tweet,user_id,user_name,user_screen_name,timestamp,retweets,favourites
351279986872811520,ガンダムは主人公と同じ性別、年齢をメインのターゲットにしているのかな それならその層からの受けが悪かったageや00はどうなるのだろう…,362027638,蒼莱,00noyamaww,2013-06-30 19:04:10,0,0
380812403601989632,vita版拡散性ma 討鬼伝 バトオペプレイ中,362027638,蒼莱,00noyamaww,2013-09-20 06:55:26,0,1
381174792914608128,vita版拡散性ma 討鬼伝 バトオペプレイ中,362027638,蒼莱,00noyamaww,2013-09-21 06:55:27,0,0
381537179299610624,vita版拡散性ma 討鬼伝 バトオペプレイ中,362027638,蒼莱,00noyamaww,2013-09-22 06:55:26,0,0
381899564631855104,vita版拡散性ma 討鬼伝 バトオペプレイ中,362027638,蒼莱,00noyamaww,2013-09-23 06:55:26,0,0
382261953655087105,vita版拡散性ma 討鬼伝 バトオペプレイ中,362027638,蒼莱,00noyamaww,2013-09-24 06:55:26,0,0
382624342766399488,vita版拡散性ma 討鬼伝 バトオペプレイ中,362027638,蒼莱,00noyamaww,2013-09-25 06:55:26,0,0
382986767583821827,vita版拡散性ma 討鬼伝 バトオペプレイ中,362027638,蒼莱,00noyamaww,2013-09-26 06:55:35,0,0
383349157630451712,vita版拡散性ma 討鬼伝 バトオペプレイ中,362027638,蒼莱,00noyamaww,2013-09-27 06:55:36,0,0
383711543315030016,vita版拡散性ma 討鬼伝 バトオペプレイ中,362027638,蒼莱,00noyamaww,2013-09-28 06:55:35,0,0
383974491358912513,@PrUtq さくちけ復活最高 神秘のマスタリーくださ,362027638,蒼莱,00noyamaww,2013-09-29 00:20:27,0,0
384073927556734976,vita版拡散性ma 討鬼伝 バトオペプレイ中,362027638,蒼莱,00noyamaww,2013-09-29 06:55:34,0,0
384191897444425728,@PrUtq うん,362027638,蒼莱,00noyamaww,2013-09-29 14:44:20,0,0
384235873077719040,@PrUtq ダークォース30と攻撃スキルの30ちょうだい,362027638,蒼莱,00noyamaww,2013-09-29 17:39:05,0,0
384436316408000512,vita版拡散性ma 討鬼伝 バトオペプレイ中,362027638,蒼莱,00noyamaww,2013-09-30 06:55:34,0,0
384798704214884352,vita版拡散性ma 討鬼伝 バトオペプレイ中,362027638,蒼莱,00noyamaww,2013-10-01 06:55:34,0,0
416555839986475008,信長の野望新作をちょこちょこプレイ＾＾今回は武勇が大事なんですねえ　脳筋キャラも気兼ねなく使っていけそうです,362027638,蒼莱,00noyamaww,2013-12-27 22:07:06,0,0
416560187411951616,@fukuda320 ウズミ様が第一世代のドラグーン付きMSをカガリに託したということは、カガリは相当の空間認識能力の持ち主ということになります？！,362027638,蒼莱,00noyamaww,2013-12-27 22:24:22,0,0
416721866653319168,@YAGIYAGIFAKE 横から失礼します　できることなら、娘に直接引き金を引かせたくない父の想いが込められているのではないでしょうか。,362027638,蒼莱,00noyamaww,2013-12-28 09:06:49,0,0
448085286480642048,ストアに萌え戦あったから懐かしいなーと思いながらプレイし始めた,362027638,蒼莱,00noyamaww,2014-03-24 22:13:51,0,0
519458845005860864,BCだとクロアンは１０日レコンギスタは１２日か,362027638,蒼莱,00noyamaww,2014-10-07 21:06:54,0,0
520592291153457155,ユークリッドって強いイメージがないんだけどなぁ。DESTINYじゃイザーク達に落とされてるし…。設定だけなら化物なんだけどね。,362027638,蒼莱,00noyamaww,2014-10-11 00:10:49,0,0
520593760829198337,陽電子リフレクター＋超火力のビーム砲って何気にチートだよな,362027638,蒼莱,00noyamaww,2014-10-11 00:16:39,0,0
520600307537944576,ゼルダのコッコ #おまえらのゲームのトラウマを挙げてけ,362027638,蒼莱,00noyamaww,2014-10-11 00:42:40,0,1
520810980280774656,ルルーシュって将棋も強いのかな？盤面ばかりに集中して予期せぬ援軍が現れ逆転されるってのが結構あるから意外と脆そう。その辺はヤン提督に通じるものがあるか。,362027638,蒼莱,00noyamaww,2014-10-11 14:39:48,0,0
520845093524094976,クロアン…SEがディヴァインウォーズと同じだ。このSE軽い感じであんまり好きじゃないんだよなぁ。撃破される時プチプチ言っててなんかね。SEはゾイドとSEEDが良い！,362027638,蒼莱,00noyamaww,2014-10-11 16:55:21,0,0
520855833706369024,広島きついな。明日明後日台風で流れるだろうし…。阪神がクライマックス初戦勝利ってそら台風も来るわ。,362027638,蒼莱,00noyamaww,2014-10-11 17:38:02,0,0
521489748901105664,ポケ戦にザクをジムのパーツで修理するという話があったけど、ジムとザクってパーツの互換あんのかねぇ？どっちもアナハイムだから可能なのか？ザク頭のZも不思議だけどアナハイムだからいけるか。アナハイムは凄いや！,362027638,蒼莱,00noyamaww,2014-10-13 11:36:59,0,0
521490809388937216,コードギアスではコピー品とはいえ、奪った敵メカの腕を即くっつけぴったりフィットなんてのもあったなぁ。陣営も製造元も違うのにな。KMFはメダロットみたいに色々カスタマイズできそうで面白いな。紅蓮の腕くっつけたランスロとか。,362027638,蒼莱,00noyamaww,2014-10-13 11:41:12,0,0
521491961358733312,メダロット感覚のカスタマイズだとプラモの販促にもなるか。でもギルフォードとかコンクエクターとかはどっちにしろ売れ残るか。ヴィンセント（ギルフォード機）とかカラバリ失敗のいい例だろう。てかギアスのプラモまた組みたいね。ネットかリサイクルショップくらいじゃないと買えないけど。,362027638,蒼莱,00noyamaww,2014-10-13 11:45:47,0,0
521492903617511426,ギアスのプラモは価格はちょいと高いけども、稼働も完成度も文句なしで同年代のガンプラ（００）と並べて比較すると栄える。,362027638,蒼莱,00noyamaww,2014-10-13 11:49:31,0,0
521494491895570432,ヴィンセント（ロロ）の金色は低価格なプラモながら、上手く再現されてる。ストフリとアカツキで培ったものだからな。アルヴァアロンは…うん…。ストフリで金色の再現は難しいと学んだはずなのになんであんな機体出したんだ？と…,362027638,蒼莱,00noyamaww,2014-10-13 11:55:50,0,0
521621956836069379,Gレコもっとぬるぬる動くと期待してたけど、あんまり動かないね。まだ序盤だからセーブしてるのか？それでも迫力が感じられるしかけあいとかBGMの盛り上がり方で退屈にならんな。ただぬるぬる動くってだけの戦闘シーンよりはこっちのが全然良いわ。,362027638,蒼莱,00noyamaww,2014-10-13 20:22:20,0,0
521629268430696448,森川がライバルポジだと思ってたら、そんなことはなく、早々に退場しやがった。,362027638,蒼莱,00noyamaww,2014-10-13 20:51:23,0,0
521631423287939072,森川って富野監督のガンダム作品じゃ碌な扱い受けていないような…。,362027638,蒼莱,00noyamaww,2014-10-13 20:59:57,0,0
521632111871008769,富野じゃなくても星屑のラバン。あっ,362027638,蒼莱,00noyamaww,2014-10-13 21:02:41,0,0
521632466595876865,「連邦に下ったか」でドムトロに瞬殺されたやつ。,362027638,蒼莱,00noyamaww,2014-10-13 21:04:06,0,0
521633556284456962,パワードジムとかも悲惨だけど、冒頭の模擬戦でスペックの高さが描写されてるからまだね。それでも後の扱いと比較の対象がザクのせいでハイスペさが伝わってこなかったけどね。,362027638,蒼莱,00noyamaww,2014-10-13 21:08:25,0,0
521636574769860609,図鑑か何かでパワードジムの性能見たんだっけな。本編見てたときは完全にジムカスのが上だと思っていただけにびっくり。けれどあの二機ジムライフルとマシンガン、バズーカじゃどちらも高出力のジェネレーターが宝の持ち腐れだと思うんだよな。,362027638,蒼莱,00noyamaww,2014-10-13 21:20:25,0,0
522300680099209216,ディスガイア3、ROA、忍道がフリープレイとか。全部ダウンロードするわ。,362027638,蒼莱,00noyamaww,2014-10-15 17:19:20,0,0
522301693396938754,フリープレイ落としまくるのはいいけど、全然消化できてない。ソフト買わずともやりたいゲームで溢れるってvita最高だな。,362027638,蒼莱,00noyamaww,2014-10-15 17:23:22,0,0
523271092270403585,後方だと言ってもルナツーのセキュリティレベルの低さは異常。,362027638,蒼莱,00noyamaww,2014-10-18 09:35:24,0,0
523325598601449472,ギレンの続編まだかのう。脅威Vからだから5年位出てないのか。いやもう脅威V＋αの移植でいいから閃光の果てにとタチアナを…,362027638,蒼莱,00noyamaww,2014-10-18 13:12:00,0,0
523337823126949888,TCGは少ないカード資産で色んなカードに触れながら遊んでる時が一番楽しい。何万も金積んでテンプレデッキコピー使用しながら舌打ち連発しだしたら終わりだ。COJはそれであほらしくなって辞めた。,362027638,蒼莱,00noyamaww,2014-10-18 14:00:34,0,0
523733011464863744,@puzzlerainbow ハマると生活に支障をきたすレベルだからな。最近はさらに酷くなり架空のカード1枚ランダムで500円とか酷すぎて課金どころかプレイする気も起こらんから助かる。,362027638,蒼莱,00noyamaww,2014-10-19 16:10:55,0,1
523735905245229056,戦い方を教えてやる（フラグ）,362027638,蒼莱,00noyamaww,2014-10-19 16:22:25,0,0
523736346272071680,安彦先生のヤマトタケル読むか。,362027638,蒼莱,00noyamaww,2014-10-19 16:24:10,0,0
523745116083609600,Gレコのキャラはなんで皆「でしょ」をつけるんだ,362027638,蒼莱,00noyamaww,2014-10-19 16:59:01,0,0
523745477645180928,4人乗りのガンダムとか強い。精神コマンド4人分のガンダムとかマジチート。,362027638,蒼莱,00noyamaww,2014-10-19 17:00:27,0,0
523813803285176322,クロスアンジュには一度国に帰れるアンジュだが、戦場での生活に慣れすぎたいせいで穏やかな世界では生きた心地がせず結局戦場に戻るという展開を激しく希望しています。,362027638,蒼莱,00noyamaww,2014-10-19 21:31:57,0,0
524480652863737858,銀英の再放送、そういやこんな感じだったなーと思いながらちょくちょく見てます。首飾りの弱点はわざと残したまま作ったような印象がありましたが、フェザーン側の会話を聞く限りそうではないんですね…。まぁあの禿のことだからわかりませんけど。,362027638,蒼莱,00noyamaww,2014-10-21 17:41:46,0,0
524522209721593856,要塞同士の砲撃戦は熱い。アクシズとゼダンの門、ガイエスブルグとイゼルローンにデス・スターでスーパー要塞大戦出しちゃえよもう。,362027638,蒼莱,00noyamaww,2014-10-21 20:26:54,0,0
524908771772870656,今年はパワプロ買うかな。携帯機で栄冠できるだけで価値がある。2013年以外は毎年買ってるけどね。2013も今になってちょっとやってみたいと思い始めた。,362027638,蒼莱,00noyamaww,2014-10-22 22:02:58,0,0
525248912152465408,シュザンナの話、一番悪いのはフリードリヒ4世だよなぁ。,362027638,蒼莱,00noyamaww,2014-10-23 20:34:33,0,0
525669350112382976,豪華過ぎる声優陣に驚愕！？アニメファンが選ぶ「声優がもっとも豪華だったと思うアニメ作品」TOP20！ | ニコニコニュース http://news.nicovideo.jp/watch/nw1290101  #niconews 蒼天航路　聞いたことある声ばかり…,362027638,蒼莱,00noyamaww,2014-10-25 00:25:14,0,0
526171299932942337,クロスアンジュ 天使と竜の輪舞でガンダムSEEDのOP映像を再現してみた (3:02) http://nico.ms/sm24619556  #sm24619556　やっぱり福田さんは凄いわ,362027638,蒼莱,00noyamaww,2014-10-26 09:39:48,0,0
526271602703355904,ジムコマンドって10月のギレン演説の時にはできてたんだっけ？,362027638,蒼莱,00noyamaww,2014-10-26 16:18:22,0,0
526275363517640704,後付が多すぎてわかんねーな。オリジン映像化でもっと意味不なことになるのかな。,362027638,蒼莱,00noyamaww,2014-10-26 16:33:19,0,0
526276591291097088,打ち切りにならなければグラナダ戦やペズン機体も見られたんでしょうな。どうせならORIGINで読みたかったなーと。,362027638,蒼莱,00noyamaww,2014-10-26 16:38:11,0,0
526277842825269248,ペズンはガッシャ以外は後の作品で浸透して救われたね。ガッシャは…ギレンの野望で報われたのか…？ミサイルの印象しかないが(´Д⊂ヽ,362027638,蒼莱,00noyamaww,2014-10-26 16:43:10,0,0
526284250966814721,ガンダム1番機に頭部を失ったアレックスがどうなったのか。まだまだネタはあるし安泰やね。あっザメルを大量生産し物量で連邦を潰そうとするのは却下で。,362027638,蒼莱,00noyamaww,2014-10-26 17:08:37,0,0
526284825443827713,ジオン残党がビグザム小隊投入！,362027638,蒼莱,00noyamaww,2014-10-26 17:10:54,0,0
526298237485871105,オーバーワールドはクリアしすぎて飽きた。,362027638,蒼莱,00noyamaww,2014-10-26 18:04:12,0,0
526647633612271616,GジェネはPが読み込み地獄じゃなければ至高。つまりダウンロード版が出れば…,362027638,蒼莱,00noyamaww,2014-10-27 17:12:35,0,0
526648460242452480,ムービー、ボリューム共に不満なし。基本冒頭イベントで落とされるモブの僚艦が使えるだけで感動したからな。,362027638,蒼莱,00noyamaww,2014-10-27 17:15:52,0,0
526650036948455425,Gジェネゼロは初心者がやると詰む難易度。12話のハイゴッグ、ズゴEのエース部隊が本拠地に向かってくるからきつい。地上からもドムが攻めてくるし…。ユウの隔離マップも胸部ミサイルが仕事してくれないと詰むし12話で投げた人は少なくないはず。,362027638,蒼莱,00noyamaww,2014-10-27 17:22:08,0,0
526650170868379648,まぁ、3話でガンダムエースにして大量生産すればヌルゲーと化すんですがね…。,362027638,蒼莱,00noyamaww,2014-10-27 17:22:40,0,0
526650557830660096,3話じゃなくて4話だったかな。3話はキャノンかタンク？,362027638,蒼莱,00noyamaww,2014-10-27 17:24:12,0,0
526682066407026688,スカグラ、セルファイター、黒餡を見るに福田監督は空中戦の演出が丁寧なんだよね。雲や機体のスライドが自然で魅せ方が上手。マクロスとかエリパチやるべきだったんだよ…。エールストライクの飛行不可で滑空って設定も彼じゃないと上手く映像化できんだろう。,362027638,蒼莱,00noyamaww,2014-10-27 19:29:24,0,0
526683500217245697,黒餡３話のアンジュが最低すぎてなぁ。,362027638,蒼莱,00noyamaww,2014-10-27 19:35:06,0,0
526686779886141440,３話から回想とか福田節全開だな！,362027638,蒼莱,00noyamaww,2014-10-27 19:48:08,0,1
526687600547880960,回想の台詞とキャラの言い回しが特徴的。,362027638,蒼莱,00noyamaww,2014-10-27 19:51:24,0,0
526700817017872385,毎週見るのが楽しみなアニメってヤマト以来だな。黒餡とGレコ,362027638,蒼莱,00noyamaww,2014-10-27 20:43:55,0,0
527440776951648256,黒餡は大成功って感じですね。,362027638,蒼莱,00noyamaww,2014-10-29 21:44:15,0,0
527450681418866688,@yuuki19880420 褒めてますけど＾＾；,362027638,蒼莱,00noyamaww,2014-10-29 22:23:36,0,0
528408921535307776,Gジェネpの攻略本見てたけどオリキャラこんな少なかったのか。マーク、エリス、クレアは安定としても、制服がエウーゴなのは…ネオの使い回しかな,362027638,蒼莱,00noyamaww,2014-11-01 13:51:18,0,0
528409334212882432,黒餡のライフル、金間接は作りやすい色合いになってるね。バンダイへの配慮も忘れない福田は気配りができる男。,362027638,蒼莱,00noyamaww,2014-11-01 13:52:57,0,0
528779109858426880,今の技術ならヴィルキスのライフルも関節も再現できるな、,362027638,蒼莱,00noyamaww,2014-11-02 14:22:18,0,0
528781772109017088,背負い物飛行ユニットの演出は福田が一番だよなぁ。,362027638,蒼莱,00noyamaww,2014-11-02 14:32:53,0,0
528786965072576512,モンテーロの噛ませっぷりが酷い。今月発売なのにこの調子でキット売れるのか？,362027638,蒼莱,00noyamaww,2014-11-02 14:53:31,0,0
528787429709197312,モンテーロの見せ場は3話なのに…発売は今月末…。これは駄目だ。と言っても、最近じゃデス種くらいしか販促上手いガンダムないよね。,362027638,蒼莱,00noyamaww,2014-11-02 14:55:22,0,0
528788242456252416,その3話でも圧力が感じられなかったけど…5話の扱いは酷いわ。ネタキャラ化するくらいなら種デスのアビスみたいに視聴者の胸に残るよう綺麗に散らして売り込んだほうがいい。,362027638,蒼莱,00noyamaww,2014-11-02 14:58:36,0,0
528789422796333056,ガンダムSEEDでクロスアンジュ 天使と竜の輪舞のOP映像を再現してみた (3:02) http://nico.ms/sm24629302  #sm24629302　引き出しが凄い,362027638,蒼莱,00noyamaww,2014-11-02 15:03:17,0,0
528837289523179520,@yuuki19880420 00の黒田さんの悪口はやめるんだ！,362027638,蒼莱,00noyamaww,2014-11-02 18:13:29,0,0
528885528192507904,@yuuki19880420 彼の脚本はこんな再現が出来ちゃいますからね　http://www.nicovideo.jp/watch/sm6349818 ,362027638,蒼莱,00noyamaww,2014-11-02 21:25:10,0,0
528901123113893889,福田さん海で遭難して男女二人って展開好きだなぁ。,362027638,蒼莱,00noyamaww,2014-11-02 22:27:08,0,0
528906472235601922,@yuuki19880420 引き出しの少なさで言ったらと思いまして（＾＾；）伝わらなかったようですね,362027638,蒼莱,00noyamaww,2014-11-02 22:48:24,0,0
528906685260107776,過激なアンチはメビウススレのような無害なファンの拠り所まで潰しちゃうから嫌い。,362027638,蒼莱,00noyamaww,2014-11-02 22:49:15,1,0
528930155641593856,俺もメビウススレにはよく書き込んでただけにアンチの爆撃には怒りを感じている。,362027638,蒼莱,00noyamaww,2014-11-03 00:22:30,1,0
528932391780249602,まあメビウススレの大半は、エア視聴者だったけどね。とんちんかんなこと言うからすぐにエア視聴だってわかる。あんなやりとりしてるんだから荒らされても文句言えないんだよなあ…,362027638,蒼莱,00noyamaww,2014-11-03 00:31:23,1,0
529075703300362240,バトデスはエアプで叩くし黒餡はエア視聴で叩くし福田アンチは…,362027638,蒼莱,00noyamaww,2014-11-03 10:00:52,0,0
529076522867359744,ペルソナ４より売れなかったら爆死らしいしね。GE2以外爆死じゃないか！,362027638,蒼莱,00noyamaww,2014-11-03 10:04:07,0,0
529108076880609280,@yuuki19880420 その通りです。ネットでくだらない工作をやってるくらいですから、時間は有り余ってるはずなのに。,362027638,蒼莱,00noyamaww,2014-11-03 12:09:30,1,0
529110174326222848,ヤン提督の前世が色んな所で発見されている。戦国時代で大名やってたり、ファンタジー世界で軍師やってたり、傭兵部隊の戦闘機乗りやってたり。,362027638,蒼莱,00noyamaww,2014-11-03 12:17:50,0,0
529133022004535296,黒餡の戦闘シーン少ないのは世界観構築に時間を費やしてるから仕方ないね。2クールなら5話は使わないと話にならない。,362027638,蒼莱,00noyamaww,2014-11-03 13:48:37,0,0
529133967622955008,黒餡のノーマに比べりゃスクライドのアルター使いって生温いよな。,362027638,蒼莱,00noyamaww,2014-11-03 13:52:23,0,0
529134416602226688,ホーリーに隷属すれば、一応人並みの生活は確保されるんだから。,362027638,蒼莱,00noyamaww,2014-11-03 13:54:10,0,0
529155153941651456,@yuuki19880420 戦うことを強要されますからね。ホーリーは断ることも出来ます（ただし戦場とは別の場所で強制労働させられますが）。拒否できる分、ホーリーの方が生暖かいと思えます。,362027638,蒼莱,00noyamaww,2014-11-03 15:16:34,0,0
529156871249092608,アンジュ「ここでは味方機を落としても銭になるのかい？」,362027638,蒼莱,00noyamaww,2014-11-03 15:23:24,0,0
529157572297637889,谷口がキラそっくりのキャラを作って自作品内でフルボッコにした仕返しにし、黒餡でルルそっくりのキャラを作ってフルボッコにしようぜ！！早くアンジュのお兄さんにルルの偽善に満ちた台詞を吐かせまくってボコるんだ！,362027638,蒼莱,00noyamaww,2014-11-03 15:26:11,0,0
529157841022500864,まぁ福田さんは谷口と違って大人だからそんなくだらないことしないか。,362027638,蒼莱,00noyamaww,2014-11-03 15:27:15,0,0
529164616341786624,クレしん映画で七人の侍モチーフにした人達が出てたの…なんだったかな…,362027638,蒼莱,00noyamaww,2014-11-03 15:54:10,0,0
529185843055820800,【MAD】 マブラヴ×スパロボファンが一度は想像すること: http://youtu.be/1dsMGd6UzKM  @YouTubeさんから　宇宙クジラとストフリも参戦できそうだ。,362027638,蒼莱,00noyamaww,2014-11-03 17:18:31,0,0
529190519184687104,福田は規制が怖くて富野が嫌う女子系アニメに逃げるクリエイターの目を覚まさせようとしてるのかも。対規制派の最後の砦だよ。,362027638,蒼莱,00noyamaww,2014-11-03 17:37:06,0,0
529191934519021568,黒餡が万人受けするかどうかで、クリエイター逹も規制に対する考えも変わってくるだろう。女子系アニメばかりになるのは…やだなぁ。,362027638,蒼莱,00noyamaww,2014-11-03 17:42:43,0,0
529193558398353409,「最近のアニメは癒し系、女子系に偏っている気がする」←業界への疑問を投げかけつつ、批判はしないという回避が上手な意見だ。本音では今の業界を否定しているんだろうけど、誰も怒らせない物言いができるのは流石だなって思えたわ。,362027638,蒼莱,00noyamaww,2014-11-03 17:49:10,0,0
529195417318076416,デザイナーを怒らせたり一般人のファンに噛み付いたり、ファンの質問をはぐらかし２chの荒らし認定しブロックしたりする副業でアニメ監督をやってる某Twitter炎上芸人とは大違いだ。,362027638,蒼莱,00noyamaww,2014-11-03 17:56:34,0,0
529196886603755521,著名人が公の場で名指しではないといえ個人に対して怒りを表すってよっぽどだよ。メカデザイナーのKさん、相当怒ってたんだろうなぁ。,362027638,蒼莱,00noyamaww,2014-11-03 18:02:24,0,0
529204834805637120,呟きくらい自由にさせてあげればいいのにね。,362027638,蒼莱,00noyamaww,2014-11-03 18:33:59,0,0
529215761437294593,@yuuki19880420 未成年のアイドルとかならまだ納得できますが、流石にいい年した大人ですよね？自分の言葉にも責任をもっているでしょう。,362027638,蒼莱,00noyamaww,2014-11-03 19:17:24,0,0
529227694244786176,岸本みゆきさんは脚本家として1流だが、評論家としても1流だと思うね。,362027638,蒼莱,00noyamaww,2014-11-03 20:04:49,0,0
529255877300072448,七人の侍は「自分の家を捨てて他人の家のために竹槍なんか取れるか」と身勝手な事を言う百姓を叱るシーンが好きだ。それまで穏やかだった勘兵衛が突然豹変して鬼になるギャップがたまらん。,362027638,蒼莱,00noyamaww,2014-11-03 21:56:48,0,0
529256757793525761,曹操だったらその場で首を跳ねてたな。,362027638,蒼莱,00noyamaww,2014-11-03 22:00:18,0,0
529257509962256384,@yuuki19880420 彼のAGEへの批評は的確ですよね。,362027638,蒼莱,00noyamaww,2014-11-03 22:03:18,0,0
529549797858897921,@yuuki19880420 語るまでもないということでしょう。最近はああいった公の場で業界人の貴重なご意見が聞けるのは嬉しいものですね。劉備ストライクの絵もあがっていることですし、福田さん×岸本さんの三国伝も見てみたいですね～。,362027638,蒼莱,00noyamaww,2014-11-04 17:24:45,0,0
529550590548787200,蒼天航路は史実と違うから見れたもんじゃないとか否定しまくるくせに三國志演義は史実以上に面白いとほざく教師。あ～イライラする～,362027638,蒼莱,00noyamaww,2014-11-04 17:27:54,0,0
529553519909408768,@fukuda320 義眼とは…某オーベルシュタイン元帥みたいですね。中々見られない設定なので驚きました(゜o゜;　クロスアンジュでの医療技術はマナのお陰か恐ろしく発達していますね。コーディネイターがいるSEEDでも義眼の技術はなかったのに。,362027638,蒼莱,00noyamaww,2014-11-04 17:39:32,0,0
529554336427147265,7人の侍で美少女アニメ作ろう。,362027638,蒼莱,00noyamaww,2014-11-04 17:42:47,0,0
529580904356655105,かっこいい(*´∀｀*) pic.twitter.com/Agk0Rz19HU,362027638,蒼莱,00noyamaww,2014-11-04 19:28:21,0,0
